Notícia,Título,Link
"Enquanto o número de casos do novo Covid-19 continua subindo em países como a Coreia do Sul e Itália, a China se distancia do topo da lista de países ameaçados pela doença e Wuhan, o epicentro da origem do vírus, mostra, a cada semana, número mais positivos. Até a primeira semana de março, a cidade central da província de Hubei já havia suspendido a operação de 11 dos 14 hospitais e centros médicos construídos com caráter emergencial. Na última terça-feira (10), o departamento de saúde da cidade anunciou o fechamento da última unidade que ainda funcionava e afirmou que todas passarão por um processo severo para desinfetar as acomodações antes que sejam usadas novamente por pacientes gerais. De acordo com o portal de notícias Xinhua News, China já contabiliza mais de 55 mil curadosEm contrapartida, na última segunda-feira (9), a Itália contabilizou 930 novas suspeitas da doença e cerca de 93 mortes. O número total de casos no país europeu já passa de 9 mil.Segundo Carlos Aparicio, médico colombiano e residente de Wuhan há 11 anos, a mudança maior de rotina hospitalar ocorreu dentro dos novos centros inaugurados para conter o pico da doença. ""O nível sanitário exigido nunca foi tão grande e minuciosos. Gastamos muitos equipamentos de proteção sanitária, mais do que o normal ema época rotineira"", afirma.O centro médico onde Carlos trabalha não recebe casos há semanas. No geral, Wuhan agora apresenta uma queda de 99% na contagem de casos, registrando apenas 17 novos pacientes nas últimas 24 horas, contra o pico diário de 14.000 ocorrido no início de Fevereiro. Aos estrangeiros remanescentes de Wuhan, a China deixou de ser o pior lugar para estar. Uma estudante americana, que preferiu não se identificar, conta que se mudou para a China há cinco anos, buscando especialização na língua.Ela negou o fretamento aéreo oferecidos aos expatriados pelo governo americano. ""O preço cobrado por pessoa era muito alto e eu ainda tinha dúvidas sobre os custos médicos de uma possível quarentena que teria que fazer ao chegar em casa"", contou. A estudante conta que contabiliza os dias em isolamento desde 23 de janeiro e que as medidas severas de contenção tiveram grandes impactos.""Eu não conseguia me distrair com mais nada que fosse bom, só lia coisas sobre o vírus. Sou uma pessoa extrovertida e precisei me lembrar muitas vezes de não me entregar emocionalmente a tudo isso. Foi uma luta diária"", afirma.Segundo ela, Wuhan caminha para uma melhora incontestável. ""Ouvi de um amigo enfermeiro que as camas dos hospitais estão vazias e esperam por pessoas"", afirmou. Nas últimas duas semanas, cerca de 1/3 dos grandes bairros populacionais de Wuhan não registraram novos casos.Doug Peres também é americano, nascido na Califórnia e optou por permanecer na cidade. Segundo ele, o que mais tem melhorado recentemente é a mobilidade. Ele relembra que, desde Janeiro não consegue sair de seu condomínio sem um extremo controle por parte dos guardas de segurança.""Precisei ir a farmácia comprar remédios para a minha namorada e quando voltei, não me deixaram entrar. Precisei pular o muro para conseguir dormir em casa"", relembra com humor. Ele conta que durante os quase dois meses de quarentena severa, muitos vídeos ""tragicômicos"" circularam as redes sociais na China e que ele não foi o único da cidade que apelou para a tática. Mischa Vier, de Michigan, é professor e vive em uma vizinhança central de Wuhan e esclareceu um pouco sobre a questão de mobilidade. Como muitos foram impedidos de sair, ainda que fosse em busca de necessidades básicas, as comunidades se uniram para trocar, vender e comprar mercadorias. ""Nós tivemos muitos grupos no WeChat de compra e venda. Para ser sincero, comprei coisas deliciosas e caseiras, não tenho do que reclamar"", afirma. O norte americano de 30 anos se declara esperançoso para um retomo as atividades normais, mas projeta dificuldades para a cidade. ""Acredito que as escolas recebam aval para funcionar em meados de Abril, mas não sei como as instituições vão atrair novos professores e empregados nos próximos anos. Acredito que os salários terão que subir consideravelmente, como medida atrativa para os estrangeiros.""Os expatriados entrevistados também partilham um sentimento em comum.  “As pessoas de Wuhan são extremamente amigáveis e curiosas sobre tudo”, revelou a universitária. Mischa acredita que a hospitalidade do povo seja  o ponto mais forte da cidade e um dos motivos para que ele tenha decidido permanecer na China, mesmo mediante ao cenário causado pelo vírus.“Já estive em outras grandes metrópoles como Pequim, por exemplo, e não me senti tão bem recebido como me sinto aqui”, atesta.Até o presente momento, o governo chinês ainda não emitiu nota oficial a respeito do retorno das atividades escolares, mas já há muitas listas circulando entre os moradores contendo informações sobre os serviços e estabelecimentos que já voltaram a funcionar.Para Doug, ver a China e Wuhan caminhando, ainda que lentamente, para fora da zona caótica causada pelo Corona vírus a faz refletir sobre o que ficou de aprendizado. “Acredito que todos nós entendemos muito mais sobre tolerância depois de vivenciar isso de perto. Eu precisei tolerar uma vida inteira que fugiu do meu controle da noite pro dia, acho que daqui pra frente tudo ficará mais fácil.”Leia também:",O que mudou em Wuhan após o pico de casos de coronavírus,https://epoca.globo.com/mundo/o-que-mudou-em-wuhan-apos-pico-de-casos-de-coronavirus-1-24303938
"Um dos rostos mais vistos pelos italianos na TV na primeira semana da emergência do coronavírus, que resultou num inédito confinamento nacional, foi o do médico Giovanni Rezza, diretor do departamento de doenças infectivas do Instituto Superior de Saúde, órgão subordinado ao Ministério da Saúde e principal centro de pesquisa, controle e consultoria técnico-científica da Itália.Na atual crise, o ISS é o responsável por acompanhar a situação nacionalmente, reunindo dados regionais, vigiando a difusão e controlando as informações epidemiológicas do vírus. O instituto participa da divulgação de um boletim nacional, anunciado diariamente às 18 horas, em Roma, com o compilado das mortes do dia (mais de 1,2 mil até agora) , o número de novos infectados (média de 2 mil novos casos por dia) e os que eventualmente já se recuperaram.Desde o acirramento da crise, Rezza participa dessa divulgação - que os canais na TV acompanham ao vivo - ao lado do diretor da Protezione Civile (equivalente italiano da Defesa Civil), Angelo Borrelli, outro comissário na linha de frente do enfrentamento ao corona.""São dias longos, que parecem intermináveis. Não esperávamos nos encontrar numa situação assim tão grave, de improviso"", comentou Rezza.Em entrevista à BBC News Brasil por telefone, no fim da noite de sexta-feira (13 março), o médico disse que a Itália está sendo fortemente atingida pelo novo vírus porque ele chegou sorrateiramente num período frio em que é comum um aumento nos casos de gripe, o que dificultou a sua identificação no início.Ele conta que o coronavírus já circulava pelo Norte do país (epicentro da crise italiana até agora) pelo menos desde janeiro e que será preciso esperar mais algumas semanas para avaliar os impactos da quarentena, prevista no decreto do governo até o dia 3 de abril.Rezza reconhece falhas pontuais no início da crise e pede que os países estudem a emergência italiana para tirar lições. Na Lombardia, região do Norte e a mais afetada até agora, o sistema de saúde, considerado um dos melhores da Europa, está próximo do colapso.""Se não houver contenção no Sul, os danos serão ainda piores"", afirma ele.Guitarrista nas horas vagas e admirador da Bossa Nova, o médico de 65 anos estava colaborando com pesquisadores brasileiros da Universidade de Goiás sobre o vírus do Mayaro, disseminado por mosquitos e que pode provocar sintomas semelhantes ao chikungunya, atividade que ele suspendeu por causa da emergência do coronavírus.Confira os principais trechos da entrevista.BBC News Brasil: Como tem sido acompanhar na linha de frente a emergência nacional?Rezza: São dias longos, que parecem intermináveis. Vivemos com uma certa preocupação, pois não esperávamos nos encontrar numa situação assim. Pensávamos que o vírus fosse chegar aos poucos na Itália, mas nos encontramos improvisamente atingidos de forma pesada e numa região como a Lombardia, onde ele já deve ter começado a circular na metade de janeiro, durante o pico de influenza.BBC News Brasil: O vírus chegou durante o pico de gripe que geralmente se registra em janeiro?Rezza: Sim, entre janeiro e fevereiro. O novo vírus entrou em circulação num momento em que é normal haver mais casos de gripe. Tantos casos, no início, pareciam uma influenza. Foi difícil de diagnosticar naquele período. Esse foi um dos principais problemas. Quando nos encontramos de frente a esse situação, não tomamos tantas medidas ali para retardar a difusão.BBC News Brasil: O que faltou no início da crise?Rezza: Não aconteceu nada. Não se sabe como o vírus chegou da China. Muitas pessoas que têm o coronavírus não apresentam sintomas. Então se uma pessoa com um pouco de sintoma, que começou a tossir, mas não sentiu nada mais sério, ela começou a transmitir o vírus. Até que não se chegou a um caso grave, ninguém entendeu que o coronavírus estava por aqui. Porque todos poderiam pensar que era uma gripe, um resfriado forte. Isso provavelmente fez com que o vírus circulasse por um mês sem ser identificado, esse foi o maior problema. Quando as pessoas com infecção respiratória mais grave chegavam ao hospital, infectavam os operadores de saúde, médicos, enfermeiras, e assim o vírus se difundiu rapidamente.BBC News Brasil: Quais são as lições dessa emergência?Rezza: O problema é que o vírus se alastra muito rápido, se transmite muito facilmente, então pode infectar muita gente em pouco tempo. E isso pode provocar uma crise no sistema de saúde. Aqui temos uma população muito idosa, muitos pacientes precisam de terapia sub-intensiva ou mesmo intensiva, precisam de aparelhos para auxiliar a respiração, e aí começaram a faltar postos nas UTIs. Se não houver uma diminuição da circulação do vírus, colocamos em risco todo o sistema, na assistência e no tratamento. Colocamos em risco não só os doentes do Covid-19, mas todos os demais que convivem com outras doenças. Esse é o maior problema.BBC News Brasil: Muito se falou nesta semana sobre o estresse dos médicos e enfermeiras e a alta contaminação entre eles. A Itália está preparada para enfrentar a emergência se ela piorar?Rezza: A difusão do vírus explodiu em regiões que têm um ótimo sistema de saúde, como Lombardia e Vêneto. Os médicos italianos em geral são bem preparados. Os doentes eram muitos, muitos em UTIs, e também porque muitos operadores sanitários se infectaram, provavelmente não estavam todos preparados, faltavam máscaras apropriadas, algum problema aconteceu. Houve alguns focos de difusão dentro dos hospitais, o que é uma coisa absolutamente impensável.BBC News Brasil: Isso aconteceu por causa da natureza desconhecida do vírus ou por erro de procedimento?Rezza: Por ambos os motivos, por desconhecimento e por falta de precaução adequada. Especialmente no início. Depois, por falta de dispositivos individuais, por inexperiência ao lidar com um infecção contagiosa e perigosa, não foram tomadas todas as precauções.BBC News Brasil: No início da crise, houve desencontros de comunicação e uma certa fricção entre o governo central e os governadores das regiões. Essa relação melhorou?Rezza: Aquele foi um problema político entre o governo central e os governadores. Pode até haver desencontro sobre as questões políticas, mas a colaboração do ponto de vista científico existe e não há problema. As regiões estão colaborando, mas algumas têm um peso muito grande na emergência, como a Lombardia.BBC News Brasil: A letalidade do Covid-19 na Itália é maior do que na China (6,7% contra 2,4%). Isso se explica pela grande população idosa ou o vírus chegou aqui com alguma mutação que o tornou mais agressivo?Rezza: Não há sinal de mutação, ele é basicamente o mesmo que circulou na China. Isso se explica exatamente pela proporção maior de idosos, pessoas que já conviviam com patologias crônicas. Elas se agravam com o coronavírus.BBC News Brasil: De cada quatro vítimas de covid-19 na Itália, três são homens. Há alguma explicação?Rezza: Precisamos estudar os fatores que favorecem os danos nos homens. Precisamos observar se esse dado vai se atenuar com o tempo, ainda não temos uma evidência científica.BBC News Brasil: Como está o sistema de saúde italiano nesse momento? Trabalha-se com a hipótese da crise se agravar no Sul?Rezza: Precisamos ver se as medidas de distanciamento social vão funcionar. O grande medo é esse. Porque se um sistema de saúde como o da Lombardia entrou em crise, um dos melhores da Europa e direi também um dos melhores do mundo, certamente se a infecção chegar ao sul de forma potente provocará danos ainda maiores. Esse é um dos motivos para a quarentena ter sido imposta.BBC News Brasil: Foi uma decisão acertada?Rezza: Sim, certamente foi a melhor medida para o momento. Me surpreende que outros países europeus não estejam adotando, porque agora efetivamente é a melhor janela de oportunidade, o vírus já está circulando na Itália há algumas semanas, então eles poderiam ter feito qualquer coisa a mais para contê-lo. Da nossa parte, não tínhamos muita alternativa. Ou deixávamos o vírus se espalhar pelo sul ou tentávamos bloqueá-lo. Se não bloquear, pelo menos retardar a sua difusão.BBC News Brasil: A reação dos outros países tem sido lenta?Rezza: Havendo mas tempo, e visto aquilo que está acontecendo na Lombardia, penso que a resposta tem sido lenta. Deveriam se mexer antes. Muitos países parecem que ainda não começaram a dar atenção para a emergência.BBC News Brasil: Como o senhor avalia o comportamento social na Itália nesses dias de quarentena?Rezza: Vi uma grande mudança de domingo para segunda. Porque no domingo (dia 8) aconteceu de tudo. Gente que foi esquiar, gente que andava para a praia, pessoas que viajavam para o Sul lotando os trens. Aconteceu tudo aquilo que não deveria acontecer. Depois de segunda-feira, houve uma mudança de comportamento, como se uma preocupação tivesse tomado conta das pessoas. Em Roma, por exemplo, os casos estão aumentando, mas são relativamente poucos se comparados ao Norte. Roma hoje é uma cidade vazia, então quer dizer que alguma coisa está funcionando.BBC News Brasil: É eficaz usar máscaras?Rezza: As máscaras são uteis para a proteção dos outros. Elas bloqueiam a saliva. Se alguém tosse, ou tem um resfriado, elas diminuem o risco de infeção. Nesse ponto de vista, o uso pode ser positivo. Mas é inútil caminhar pela rua usando a máscara. Não serve para nada.","Países precisam 'se mexer', diz médico que monitora emergência do coronavírus na Itália",https://epoca.globo.com/sociedade/paises-precisam-se-mexer-diz-medico-que-monitora-emergencia-do-coronavirus-na-italia-24305666
"BRASÍLIA — O secretário de Comunicação da Presidência da República, Fabio Wajngarten, está com coronavírus. O resultado do primeiro teste que ele fez na quarta-feira no Hospital Israelita Albert Einstein, em São Paulo, confirmou que ele contraiu a doença. No momento, ele está em isolamento. A contraprova também foi confirmada. Segundo o colunista Lauro Jardim, o governo americano pediu informações sobre o secretário, que participou de jantar com Trump.Veja também: Rio tem primeiro caso de transmissão local de coronavírus, diz Secretaria de SaúdeWajngarten já avisou ao presidente Jair Bolsonaro e a ministros que foi infectado com o novo vírus, depois de integrar a comitiva que esteve nos Estados Unidos, do último sábado até a terça. Depois de retornar a Brasília, ele foi para São Paulo.Questionado se recomenda o presidente fazer um teste para o novo coronavírus, o secretário-executivo do Ministério da Saúde, João Gabbardo dos Reis, disse que terá uma reunião com os responsáveis pela saúde de Bolsonaro e a equipe da Presidência da República. Medidas acerca disso serão anunciadas somente depois do encontro.— Com a confirmação do Fábio, medidas vão ser tomadas, medidas vão ser esclarecidas em reunião que teremos após esta entrevista coletiva — disse Gabbardo.Na coletiva, o secretário de Vigilância em Saúde da pasta, Wanderson de Oliveira, destacou que qualquer um pode pegar o vírus.— Pode ser que todos aqui tenhamos corona. É verdade, é como influenza, é como a gripe — disse Wanderson.Leia:Em meio à pandemia, Brasil precisaria de 3.200 novos leitos de UTI no SUSHá quatro dias, Wajngarten publicou no seu Instagram uma foto em que aparece ao lado do presidente dos Estados Unidos, Donald Trump, e do vice, Mike Pence.Procurada pela reportagem desde quarta, a Secretaria de Comunicação Social (Secom) da Presidência não se manifestou até o momento. Trump, por sua vez, disse em entrevista nesta quinta-feira que não está preocupado com o fato de o presidente brasileiro, Jair Bolsonaro, estar sendo monitorado para a doença. Pouco após a divulgação das notícias sobre sua condição de saúde, na tarde de quarta, Wajngarten foi ao Twitter para reclamar da imprensa e dizer que está bem, mas não negou diretamente que foi ao hospital e fez teste para coronavírus.Especial visual: Entenda tudo sobre o novo coronavírus""Em que pese a banda podre da imprensa já ter falado absurdos sobre a minha religião, minha família e minha empresa, agora falam da minha saúde. Mas estou bem, não precisarei de abraços do Drauzio Varella"", escreveu o secretário de Comunicação, em referência indireta ao episódio em que o médico abraçou uma transexual presta, em reportagem do Fantástico, da TV Globo.Bolsonaro, por sua vez, está no Palácio da Alvorada desde o fim da tarde de quarta. Nesta quinta, ele iria para Mossoró (RN), mas cancelou a viagem. Segundo o ministro do Desenvolvimento Regional, Rogério Marinho, o adiamento ocorreu ""em função de razões de segurança sanitária"", por causa da decretação de pandemia mundial do coronavírus pela Organização Mundial de Saúde (OMS).Segundo Marinho, a situação obriga a ter ""uma maior segurança com a figura do presidente da República e com as pessoas que estão no seu entorno"".Ele também afirmou que Bolsonaro precisará cuidar do que chamou de ""problemas"" na votação do Orçamento e de vetos analisados pelo Congresso, sem mencionar que um deles foi derrubado pelos parlamentares e provocou um impacto de R$ 20 bilhões.Nos últimos dias, o presidente minimizou os efeitos do coronavírus e chamou de ""pequena crise"". Há quatro dias, Wajngarten publicou no seu Instagram uma foto em que aparece ao lado do presidente dos Estados Unidos, Donald Trump, e do vice, Mike Pence.Presidente da RepúblicaSra.Michelle BolsonaroMinistro de Estado das Relações Exteriores* - Ernesto AraujoMinistro de Estado da Defesa - Fernando Azevedo e SilvaMinistro de Estado de Minas e Energia -  Bento AlbuquerqueMinistro de Estado Chefe do Gabinete de Segurança Institucional/PR - Augusto HelenoGovernador do Paraná - Carlos Massa Ratinho JúniorChefe do Estado Maior Conjunto das Forças Armadas -  Raul BotelhoSen. Jorginho Mello (PL/SC)Sen. Nelsinho Trad (PSD/MS)Dep. Eduardo Bolsonaro (PSL/SP)Deputado Daniel Freitas (PSL/SC)*Embaixador Nestor Forster*Embaixador João Mendes*Assessor internacional, Filipe MartinsSecretário Especial de Comunicação Social, Fábio Wajngarten*Presidente da EMBRATUR* - Gilson Machado NetoPresidente da APEX* -  Sergio Ricardo Segovia BarbosaChefe de Operações da Apex Brasil para a América do Norte*Secretário Especial de Comércio Exterior e Assuntos Internacionais/MECON* - Marcos Prado TroyjoSecretária Especial do PPI* - Martha SeillierSecretário de Aquicultura e Pesca do MAPA* - Jorge Seif JuniorDemais integrantes técnicos *Não embarca no voo PR",Fabio Wajngarten é diagnosticado com coronavírus,https://epoca.globo.com/brasil/fabio-wajngarten-diagnosticado-com-coronavirus-24300762
"A paciente internada na Unidade de Terapia Intensiva (UTI) no Hospital Regional da Asa Norte (Hran), em Brasília, com estado de saúde classificado como grave e diagnosticada com coronavírus, mencionou sua preocupação com a possibilidade de infecção em mensagem numa rede social no primeiro dia de sua viagem ao exterior.Em 12 de fevereiro, ela publicou uma sequência de fotos ainda no aeroporto de Heathrow, logo após o desembarque na capital do Reino Unido. “Londres agora. Frio, chuva e susto do real Corona Vírus (sic)”, escreveu a passageira, que mencionou uma agenda de compromissos profissionais, incluindo visitas às universidades de Oxford e Cambridge.Ela é advogada, com escritório na Região do Lago Sul, em Brasília. Viajou acompanhada pelo marido.De acordo com boletim médico divulgado nesta terça (10) pela Secretaria de Saúde do Distrito Federal, a paciente respira com a ajuda de aparelhos e conta também com auxílio de equipamentos para a circulação de sangue. O marido teve a infecção pelo coronavírus confirmada na noite desta terça pelas autoridades de saúde do DF, conforme revelou o site G1.Nos registros da viagem, o casal chegou a gravar um vídeo, dentro de um carro, o deslocamento entre o aeroporto e o hotel, após a chegada em Londres. Foi um roteiro intenso, com passagens por cidades na Inglaterra, na Escócia e na Irlanda.Em 20 de fevereiro, ela publicou novas fotos nas ruas de Dublin, na Irlanda. Acrescentou ainda que passou também pela cidade de Belfast. Dois dias depois, ela tirou uma foto em frente ao restaurante Bem Brasil Steakhouse em Liverpool, na Região Noroeste da Inglaterra. A culinária nacional, segundo ela, ajudou a “diminuir a saudade do nosso Brasil”. Na legenda da foto diante do Shakeaspeare Centre, na cidade de Stratford, ela escreveu: “A cidade onde nasceu Shakespeare! Dispensa apresentações. O cansaço não vence uma profissional com atitude!”. Em 24 de fevereiro, publicou uma imagem com as temperaturas previstas para o dia em Londres: “Tempo nublado. Máxima: 12º C. Mínima: 4º C”. Era o fim da viagem. No mesmo dia, publicou uma foto ao lado do marido, na classe executiva da aeronave com destino ao Brasil. Na imagem, ela estava sem máscara e aparentava cansaço. Também registrou o momento em que entrou no avião, com a legenda: “Hora de voltar!”.Dois dias depois, a paciente e o marido chegaram em Brasília. De acordo com a advogada da família, Claudia Rocha, a mulher foi internada no dia 4, com a confirmação da infecção pelo vírus 24 horas depois. Ela ressaltou que, até o momento, o marido não apresentou sintomas característicos da doença.Leia também:",Brasileira em estado grave manifestou medo de coronavírus durante viagem,https://epoca.globo.com/sociedade/brasileira-em-estado-grave-manifestou-medo-de-coronavirus-durante-viagem-24297165
