Título,Notícia,Data,Link
"Em meio à covid-19, garimpo avança e se aproxima de índios isolados em Roraima","Imagens de satélite mostram que garimpeiros estão ampliando suas operações dentro da Terra Indígena Yanomami, em Roraima e no Amazonas, mesmo durante a pandemia do novo coronavírus.Segundo um boletim produzido pelo Instituto Socioambiental (ISA), que monitora a atividade na região, houve um aumento de 3% na área degradada por garimpeiros no território yanomami em março em comparação com fevereiro.Em uma das frentes, as escavações passaram a ocorrer a cerca de 5 quilômetros de uma roça recém-aberta por um subgrupo yanomami que vive em isolamento voluntário e jamais recebeu qualquer vacina.Indígenas são considerados especialmente vulneráveis à pandemia por conta de costumes que tendem a facilitar a disseminação de doenças respiratórias e da ausência de hospitais em seus territórios.No caso de indígenas isolados, os riscos são ainda maiores, pois vários desses grupos não têm qualquer memória imunológica contra outros vírus que podem ser levados por forasteiros e que poderiam agravar um eventual surto de covid-19 nas comunidades.Na última terça-feira, a Secretaria Especial de Saúde Indígena (Sesai) divulgou que um jovem yanomami contraiu covid-19 - é o primeiro caso registrado entre a etnia.O rapaz, que foi levado para a UTI de um hospital em Boa Vista, vive em uma comunidade na região do rio Uraricoera, onde há circulação intensa de garimpeiros.Na fronteira do Brasil com a Venezuela, o território Yanomami é a maior terra indígena do país, com área equivalente à de Portugal. Nele vivem cerca de 26 mil membros dos povos yanomami e ye'kwana, distribuídos em 321 aldeias.Rico em depósitos de ouro, o território é cobiçado por garimpeiros desde a década de 1970. Desde então, várias doenças levadas por não indígenas assolaram o grupo.Segundo o boletim do ISA, os novos focos de garimpo degradaram 114 hectares (o equivalente a 114 campos de futebol) de floresta na Terra Indígena Yanomami em março.As regiões que tiveram maior incremento nas escavações foram as de Hakoma e Parima, ""que até então não pareciam ter uma atividade tão intensa"", segundo o boletim.""Este aumento é especialmente preocupante nesse momento de ameaça de contágio de covid-19, pois nessas regiões estão localizadas comunidades com menos contato com a sociedade nacional, onde as pessoas, possivelmente, possuem sistemas imunológicos mais sensíveis a este tipo de enfermidade"", diz o documento.O texto também faz um alerta sobre o avanço de garimpeiros na região da Serra da Estrutura, onde um subgrupo yanomami vive em isolamento voluntário, sem contato com outras comunidades.Em março, imagens de satélite detectaram uma nova roça atribuída ao grupo isolado em um local que fica a cerca de 5 km de uma frente de garimpo ativa na região do rio Novo.Os autores do boletim dizem acreditar que a roça esteja associada justamente à tentativa de fundação de uma nova aldeia perto da zona de garimpo.""É possível que essa aproximação seja, inclusive, intencional, visando manter uma relação de troca com os garimpeiros, o que na história de contato dessa sociedade sempre resultou em tragédia para ambos os lados"", diz o boletim.Os autores do texto estimam que haja 10 mil garimpeiros no território. Eles afirmam que até agora não houve qualquer sinal de diminuição nas atividades de garimpo na região por conta da pandemia do novo coronavírus.A BBC News Brasil questionou a Funai, a Polícia Federal e o Exército sobre o avanço de garimpeiros no território yanomami, mas não obteve respostas.Os três órgãos fizeram várias operações contra o garimpo na região nos últimos anos.Em uma das iniciativas mais recentes, em janeiro de 2019, um sargento do Exército teve parte da mão decepada ao tentar interceptar um barco que transportava garimpeiros pelo rio Uraricoera.O piloto jogou a embarcação contra o sargento, que se feriu com a batida. O piloto conseguiu fugir.Apesar das repetidas operações, os autores do boletim do ISA afirmam que os garimpeiros jamais deixaram o território.Vários focos de garimpo operam em áreas com pistas de pouso clandestinas. Essas pistas conseguem garantir a chegada de alimentos e combustível para os garimpeiros mesmo quando forças de segurança realizam bloqueios nos rios da região.Conhecidos como moxihatëtëma thëpë, os indígenas isolados ameaçados pelos garimpeiros pertencem a um subgrupo yanomami monitorado pela Funai há quase uma década. Estima-se que o grupo tenha hoje cerca de 120 integrantes.Nos anos 1990, houve relatos de confrontos que opuseram os moxihatëtëma a garimpeiros e a outras comunidades yanomami nas regiões dos rios Catrimani, Mucajaí e Apiau.Chegou a se especular que o grupo tivesse sido extinto por conta dos conflitos e de doenças, até que sobrevoos identificaram as malocas e roças da comunidade em 2011.Nos últimos anos, o grupo vinha se afastando de uma frente de garimpo na região do rio Mucajaí. Os indígenas seguem se deslocando na mesma direção, só que agora se aproximam de outra frente no rio Novo.Em O papel político das epidemias: o caso yamomami, de 1993, a antropóloga Alcida Rita Ramos diz que cerca de mil indígenas - ou 14% da população da etnia em Roraima na época - morreram por conta de doenças no auge da invasão garimpeira, entre 1987 e 1990.Uma década antes, a construção da rodovia Perimetral Norte na região também expôs as comunidades a epidemias. Entre 1974 e 1975, segundo Ramos, doenças infecciosas mataram 22% da população de quatro aldeias yanomami atingidas pelas obras.""Dois anos depois, mais 50% dos habitantes de outras quatro comunidades sucumbiram a uma epidemia de sarampo"", diz a antropóloga. Entre os cerca de 130 indígenas que viviam no rio Apiaú, só sobreviveram 30.""Desgarrados, acabaram abandonando a área e juntaram-se a outras comunidades. Em fevereiro de 1992, o que fora suas terras era agora uma gigantesca área de queimadas de mais de 30 mil hectares transformados em projeto de colonização regional.""Em outra região, os 60 remanescentes de um grupo de 102 indígenas ""se dispersaram, abrindo caminho para uma intensa ocupação por colonos brasileiros do que fora terras suas"". ""Alguns desses yanomami vivem hoje como agregados nos sítios desses colonos"", escreveu a antropóloga.Em post publicado em 27 de março no Facebook, a Hutukara Associação Yanomami, principal organização indígena da região, divulgou fotos recentes de garimpeiros na região do rio Mucajaí.""Eu quero chamar a atenção das autoridades não indígenas. Na nossa Terra Indígena Yanomami (está) cada vez mais aumentando os garimpeiros ilegais, esses garimpeiros ilegais estão entrando nas comunidades e não são examinados por médicos"", diz o post.A Hutukara cobrou as autoridades a bloquear as seis principais rotas de acesso às comunidades: os rios Uraricuera, Mucajaí, Ajarani, Catrimani, Demini e Marauiá.",2020-04-09,https://epoca.globo.com/brasil/em-meio-covid-19-garimpo-avanca-se-aproxima-de-indios-isolados-em-roraima-24361472
Funcionárias da Fiocruz doam cestas básicas para moradores de Manguinhos,"Um grupo de 25 mulheres da Fundação Oswaldo Cruz (Fiocruz) organizou, de forma independente, uma ação social para ajudar moradores da comunidade de Manguinhos, na Zona Norte do Rio de Janeiro, durante a crise provocada pelo coronavírus. Nesta segunda (30), elas distribuíram 150 cestas básicas e 150 kits de limpeza e higiene pessoal, metade das doações da primeira entrega.Desde que foi divulgada no último dia 21, a iniciativa ""Solidariedade em Manguinhos"" arrecadou cerca de R$ 26 mil. Parte da verba custeou os suprimentos para 150 famílias, número mensal mínimo que a campanha almeja amparar ao menos enquanto o distanciamento social prosseguir. As doações devem se estender até atingir o montante necessário para levar a meta adiante por um semestre.A ideia se consolidou a partir do grupo do WhatsApp ""Mulheres da Fiocruz"", criado para mobilizá-las a participar do Dia Internacional da Luta das Mulheres. O propósito inicial era recolher contriubuições apenas das participantes, que passaram a compartilhar com parentes e amigos. A inesperada adesão resultou em um trabalho cada vez mais colaborativo e pensado.Um crowdfunding on-line não era a opção principal por conta das taxas e da burocracia. A solução foi disponibilizar uma conta inativa da pesquisadora Silvana Granado, coordenadora da campanha. A partir daí, o grupo dividiu tarefas para promover a campanha e criou até páginas no Facebook e Instagram. Por meio delas, os colaboradores podem acompanhar a prestação de contas.""Uma iniciativa que surgiu de forma amadora se transformou em uma estrutura quase profissional. Temos pessoas cuidando de finanças, texto, arte. E mais gente tem se unido. Não imaginávamos essa proporção"", disse Granado.O grupo também procurou líderes comunitários que ajudassem a identificar as famílias mais necessitadas. Desde então, estão em contato permanente para definir critérios de distribuição. Pessoas em extrema porbeza terão preferência, sobretudo os desempregados, informais e doentes que ficarão sem renda devido à quarentena.Participam da campanha representantes da Estratégia da Saúde da Família em Manguinhos, do movimento social Mães de Manguinhos e do projeto As minas da bola. A distribuição também contou com o apoio do Sindicato de Trabalhadores da Fiocruz (Asfoc).""Acreditamos que o distanciamento social em países subdesenvolvidos deve vir acompanhado de políticas de assistência social específicas para trabalhadores informais e autônomos. Enquanto tais medidas não são implementadas, ações de solidariedade da população que darão suporte a esses trabalhadores. A luta é coletiva"", afirmou a pesquisadora Jussara Angelo, uma das idealizadoras da ação.De acordo com o Censo de 2010, Manguinhos tem mais de 36 mil habitantes e seu Índice de Desenvolvimento Humano (IDH) à época era um dos cinco piores do município do Rio. Pesquisas recentes da Fiocruz estimam uma população aproximada de 40 mil pessoas.É no bairro onde se situa prédio central da instituição, conhecido como Pavilhão Mourisco. Esse é um dos principais motivos a que se deve a escolha da comunidade local como alvo da ação. No local, funciona ainda a Escola Nacional de Saúde Pública (ENSP), onde pesquisadores conduzem estudos sobre a temática - muitos deles imersos na realidade de Manguinhos.No campus da instituição, um hospital com 200 leitos para pacientes com sintomas graves está sendo montado no campo de futebol. A Fiocruz também atua na gestão da UPA, da Clínica da Família Victor Valla e do Centro de Saúde Escola Germano Sinval Faria - unidades de assistência da região. A fundação comemora 120 anos em maio, mas suspendeu a festa para reforçar a luta contra o coronavírus, conforme informou o colunista Bernardo Mello Franco, do Globo.""A gente vê, ali em volta, meninos que lavam carro, pessoas que vendem bala. Muitas pessoas têm trabalhos informais. Como esse povo está vivendo? Eles não vão ter renda"", disse Granado. ""A gente pede para as pessoas ficarem em casa, mas temos que dar condições"", concluiu.Segundo as organizadoras, cada cesta custou R$ 56 e os kits de higiene e limpeza, R$26 a unidade. Houve doações de R$ 20 a R$ 1 mil. Quem quiser contribuir, pode acessar as páginas da campanha para mais informações ou direto pela vaquinha virtual.  Se não puder doar em dinheiro, compartilhe essa ideia nas suas redes sociais. A luta é coletiva! Contamos com a sua solidariedade, promova você também a #solidariedadeemmanguinhos, e se puder, #fiqueemcasa 💛Uma publicação compartilhada por  Solidariedade em Manguinhos (@solidariedade_em_manguinhos) em 28 de Mar, 2020 às 2:03 PDT",2020-03-31,https://epoca.globo.com/rio/funcionarias-da-fiocruz-doam-cestas-basicas-para-moradores-de-manguinhos-24330539
As lições de três eventos catalisadores do novo coronavírus na Europa,"Apesar do tom mais moderado em pronunciamento sobre a pandemia de covid-19 na terça-feira (31/3), o presidente Jair Bolsonaro (sem partido) demonstrou nas últimas semanas sua preferência pelo fim do isolamento da maior parte da população.Em meio a atritos com governadores que implementaram medidas de distanciamento social em seus Estados, o presidente participou de eventos com aglomerações e decretou igrejas como serviços essenciais, consentindo que realizassem celebrações em espaços lotados.O argumento de Bolsonaro sobre o retorno à vida normal para preservar a economia e empregos encontrou repercussão em parte do setor empresarial, que organizou carreatas em diversas cidades brasileiras pedindo a reabertura do comércio na semana passada. A Organização Mundial da Saúde (OMS), por outro lado, continua recomendando o ""distanciamento físico"" em países com transmissão comunitária do vírus, caso do Brasil.Qual, então, seria o melhor caminho a seguir?Uma partida de futebol em Milão, na Itália, uma festa em uma boate de Berlim e celebrações de Carnaval no distrito de Heinsberg, na Alemanha, podem ensinar ao Brasil algumas lições sobre a rápida propagação do Sars-CoV-2 em diferentes ambientes e a necessidade de isolamento social.O prefeito de Bergamo afirmou na última semana de março que o jogo da Liga dos Campeões entre Atalanta, um pequeno time da cidade do norte italiano, e Valencia ajudou a espalhar o vírus no país e na Espanha — apesar de haver outros fatores envolvidos.Cerca de 40 mil torcedores assistiram à partida das oitavas de final da competição europeia no estádio San Siro, em Milão, em 19 de fevereiro. Nas semanas seguintes, mais de um terço dos jogadores e da comissão técnica do Valencia testaram positivo para o vírus, assim como diversos fãs.""O estádio estava lotado e, depois (da partida), os bares também. Com certeza naquela noite houve uma grande intensificação do contágio"", disse Giorgio Gori.A Lombardia, onde Bergamo e Milão estão localizadas, é a região italiana mais afetada pela pandemia, com 8.656 mortes confirmadas até este sábado (04/04), mais da metade do total registrado no país.No Brasil, Bolsonaro contrariou as recomendações de seu próprio ministro da Saúde para que a população evitasse aglomerações e visitou comércios em Brasília, onde chegou a posar para fotos com apoiadores.""[Um evento ao] ar livre não é uma dificuldade para a propagação do vírus se houver contato muito próximo e se alguém estiver, por exemplo, gritando ou expelindo secreções em cima de outras pessoas"", explica à BBC News Brasil o especialista em higiene e medicina preventiva Paolo Bonanni, professor da Faculdade de Medicina da Universidade Florença, na Itália. Sabe-se que o Sars-CoV-2 espalha-se, em geral, pela saliva ou secreções de pessoas infectadas que entram em contato com as mucosas de indivíduos saudáveis.""Quem tiver gotículas de saliva sobre si, tocará o nariz e os olhos porque geralmente fazemos isso entre duas ou três vezes por minuto, mesmo sem perceber. Isso ajuda a espalhar o vírus mesmo em espaços ao ar livre, como em um desfile de carnaval"", completa o médico.E foi durante festividades de carnaval que diversos casos do Estado alemão da Renânia do Norte-Vestfália se originaram. Os dois primeiros identificados na região foram um casal assintomático que participou durante alguns dias de eventos no distrito de Heinsberg. Cerca de 300 pessoas estiveram na mesma festa que o casal.De imediato, três indivíduos próximos do homem e da mulher foram contaminados. As autoridades locais tentaram rastrear uma grande quantidade de pessoas com quem eles tiveram contato, incluindo crianças e funcionários de um jardim de infância onde a mulher trabalhava. Ao todo, cerca de mil moradores foram colocados em quarentena e escolas e prédio públicos fecharam.O vírus, contudo, se espalhou por toda a Renânia do Norte-Vestfália. Atualmente, o Estado tem o segundo maior número de casos (18.735) da Alemanha, atrás da Bavária (23.846), de acordo com os dados divulgados neste domingo (05/04) pelo Robert Koch Institute (RKI), agência do Ministério da Saúde responsável pelo controle de doenças no país.O distrito de Heinsberg, localizado na região, tem um dos piores índices de casos por 100 mil habitantes.Entre 12 e 30 de março, foi o único em todo o país considerado uma ""área particularmente afetada"" pelo RKI, que abandonou a classificação uma vez que o vírus ""está espalhado por toda a Alemanha"" e ""há surtos em muitos distritos"".A OMS recomenda que países com transmissão comunitária considerem adiar ou reduzir eventos que possam provocar aglomerações.Em uma breve análise de estudos relevantes para a pandemia do SARS-CoV-2, o Centro de Medicina Baseada em Evidências (CEBM) da Universidade de Oxford identificou algumas evidências sobre a eficiência de algumas medidas para desacelerar a transmissão de vírus semelhantes.Entre os achados estão a quarentena daqueles que tiveram contato com infectados, fechar escolas e a proibição de reuniões públicas - que, ""em combinação com outras intervenções, por uma média de 4 semanas, poderia reduzir a taxa de mortalidade semanal"". No dia 25 de março, o presidente brasileiro informou que o governo federal recomendava o ""isolamento vertical"" da população, afastando do convício social apenas idosos e pessoas com doenças pré-existentes. Uma afirmação que gerou críticas entre especialistas para os quais um isolamento amplo é mais adequado para desacelerar a propagação do vírus.""A recomendação é que todos aqueles com sintomas fiquem em casa. Não apenas os idosos ou aqueles com sistema imunológico comprometido. A razão para isso é que as pessoas que estão em boa forma e que se infectam com um caso leve podem transmiti-lo a grupos vulneráveis'', explica David Nunan, pesquisador sênior do CEBM.""No momento, não há outra opção. Sem um distanciamento social severo, haverá problemas. Temos que ganhar tempo para que muitas pessoas não acabem na emergência dos hospitais"", completa Bonanni.A propagação do novo coronavírus é ainda mais eficiente em locais fechados, conforme a famosa vida noturna de Berlim pôde confirmar pouco depois de o primeiro caso ser identificado na capital alemã.Uma festa em 6 de março na boate Kater Blau, uma das mais famosas da cidade, foi o foco de diversas contaminações. Segundo a emissora alemã Welt, um homem que havia retornado da China com sintomas do covid-19, a doença causada pelo novo coronavírus, esteve por diversas horas no local.Uma jovem e dois amigos que visitaram a boate naquele dia testaram positivo. Assim como o homem que os contaminou, eles mantiveram contato com dezenas de pessoas na festa e nos dias seguintes. Um deles trabalhava em um mercado, onde expôs centenas de clientes ao vírus. Somente no dia 14, após não conseguir respostas de autoridades locais, a boate anunciou que alguém contaminado esteve na festa. Logo depois, a cidade postou um pedido para que os participantes do evento festa entrassem em contato. Mais de mil pessoas responderam.Em uma entrevista ao Welt, a jovem mencionada anteriormente disse que cerca de metade das 30 pessoas com quem teve contato ficaram doentes, mas não fizeram o teste.E essa não foi a única boate com casos de covid-19 registrados na cidade. Uma pessoa infectada contaminou ao menos outras 50 em um local chamado Trumpet.""Para o coronavírus, uma pessoa, em média, contaminará outras três. Mas se houver alguém infectado em um ambiente muito fechado em que alguém esteja em contato com 50 pessoas, todas elas poderão estar contaminadas"", explica Bonanni.""Devemos considerar ainda que, especialmente para os coronavírus, existem pessoas consideradas 'supertransmissoras'. Elas replicam muito mais vírus que a média. Nesse sentido, se alguém em uma boate for supertransmissora, ela é capaz de contaminar o meio e muitas pessoas. Não há limite para o número que se pode contaminar em ambientes fechados"", diz.Conforme os primeiros casos do novo coronavírus são confirmados nas favelas brasileiras, muitas delas densamente habitadas, os especialistas mostram preocupação com a velocidade com a qual o vírus pode se espalhar. Seria um cenário semelhante ao de uma boate se os habitantes dividirem casas pequenas com muitos moradores.""Sabemos que áreas grandes e densamente povoadas com pobreza generalizada são mais vulneráveis a pandemias suspensas no ar. Creio que a covid-19 se espalharia rapidamente se não houvesse medidas de contenção nessas comunidades"", argumenta Nunan. Para Bonanni, nesse cenário são altas as chances de toda a família ser infectada e seria muito difícil conter o ""número de pessoas com uma doença grave"".""Para fazer uma comparação, a Itália só descobriu o problema quando o incêndio já era grande. Espero que o incêndio seja menor no Brasil. Mas se for tão grande quanto no final de fevereiro na Lombardia, será um problema muito, muito grande para as pessoas que vivem em espaços restritos.""Um levantamento da BBC News Brasil indica que o Brasil teve mais mortes por dia do que a Itália, atualmente o país com mais vítimas pela pandemia, desde que o primeiro óbito foi registrado. ""Se a situação do Brasil fosse muito semelhante à da Itália, eu ficaria muito preocupado em não fazer um distanciamento muito claro. Se fosse o mesmo que em alguns países europeus, deveria fechar tudo"", diz Bonanni.""É um equilíbrio difícil entre saúde e economia, mas acho que o primeiro dever de qualquer governo é a saúde e a segurança de seu povo"", afirma Nunan.Os três exemplos europeus indicam a necessidade de se agir rápido e que não se deve menosprezar como o vírus se espalha por meio de poucas pessoas.",2020-04-05,https://epoca.globo.com/sociedade/as-licoes-de-tres-eventos-catalisadores-do-novo-coronavirus-na-europa-24352939
