Título,Notícia,Data,Link
"Pela quarta vez seguida, Cristiano Ronaldo é eleito o melhor do ano no Globe Soccer Awards","Pela quarta vez consecutiva, o craque português Cristiano Ronaldo foi eleito o melhor do ano no Globe Soccer Awards, cuja 11ª edição aconteceu neste domingo (29) em Dubai. Essa é a primeira vez em 2019 que ele desbanca o argentino Lionel Messi, escolhido o melhor do mundo nas três principais premiações do futebol - entre elas o The Best, concedido pela FIFA.Além de Messi, Ronaldo superou ainda o quarteto do Liverpool formado por Mohamed Salah, Sadio Mané, Virgil Van Dijk e Alisson e o meia português Bernardo Silva, do Manchester City. Seu conterrâneo Joao Félix, quarto jogador mais caro da história contratado pelo Atlético de Madrid, ganhou como revelação do ano, categoria à qual concorreram também Erling Haaland, do RB Salzburg; Jadon Sancho, do Borussia Dortmund; e Kai Havertz, do Bayer Leverkusen. Agente de Cristiano Ronaldo, Jorge Mendes foi outro português a ter trabalho reconhecido.Após o título do Mundial de Clubes, o Liverpool venceu o prêmio de melhor clube do ano, coroando a temporada de sucesso em que conquistou a Liga dos Campeões, a Supercopa da UEFA e o vice-campeonato da Premier League, apenas um ponto atrás do Manchester City.O clube inglês ainda emplacou outros dois nomes: o técnico Jürgen Klopp e o goleiro brasileiro Alisson venceram em suas categorias - foram 15 no total.Esta foi a primeira edição do Globe Soccer Awards que incluiu mulheres entre os premiados. Os indicados foram selecionados por um júri internacional composto por treinadores e executivos do esporte.Confira abaixo a lista dos ganhadores de cada categoria da premiação:Melhor jogador - Cristiano Ronaldo (Juventus)Melhor revelação - João Félix (Atlético de Madrid)Melhor jogadora - Lucy Bronze (Lyon)Melhor técnico - Jürgen Klopp (Liverpool)Melhor goleiro - Alisson (Liverpool)Melhor clube - LiverpoolMelhor árbitro - Stephanie FrappartMelhor agente - Jorge MendesPrêmio de carreira como jogador - Miralem Pjanic e Ryan GiggsMelhor Academia - Ajax (HOL) e Benfica (POR)Melhor diretor esportivo - Andrea Berta (Atlético de Madrid)Melhor jogador árabe - Abderazak Hamdallah (Al Nassr FC)Melhor jogador árabe jovem - Achraf Hakimi (Borussia Dortmund)Melhor clube árabe - Al HilalMelhor parceria - Manchester City e SAPLeia também:",2019-12-30,https://epoca.globo.com/esportes/pela-quarta-vez-seguida-cristiano-ronaldo-eleito-melhor-do-ano-no-globe-soccer-awards-24164507
"Desconfortável com o barulho do estádio, menino autista recebe ajuda em partida na Arena Corinthians","Ir ao estádio torcer pelo time do coração, um simples passeio de domingo, comum para milhares de famílias pelo Brasil apaixonadas por futebol, movimentou uma discussão nas redes sociais sobre inclusão em atividades de esporte e lazer. No último dia 17, Joyce Favaro e o marido decidiram em cima da hora ir à Arena Corinthians, em São Paulo, junto com Leandrinho, filho de seis anos do casal, portador do Transtorno do Espectro Autista (TEA). Mas o som barulhento e o aperto típico de uma arquibancada de estádio deixaram o menino estava desconfortável no meio da multidão.Com pai e mãe apaixonados pelo time, Leandro começou a frequentar os estádios ainda na barriga da mãe. Joyce conta que, mesmo grávida, frequentou os jogos do Corinthians até o oitavo mês de gestação, no meio das torcidas organizadas.Diagnosticado com TEA aos cinco anos, o grau de autismo de Leandro provoca maior sensibilidade sensorial — ele é mais sensível à textura de alimentos, ao frio, dor e também ao barulho. O menino já tinha ido a um jogo do Corinthians na Arena quando mais novo, mas por ser uma partida menos disputada, não tiveram problemas.Desta vez, na partida entre Corinthians e Internacional, pelo Campeonato Brasileiro, a família ficou no setor superior, onde o som costuma ser mais alto pela acústica do estádio. Segundo Joyce, foi quando o barulho se intensificou e os torcedores ficaram de pé que o menino começou a se sentir mal. “Ele sempre acompanhou os jogos, para ele é uma festa. Mas, realmente, foi uma ocasião diferente, ele ficou bastante incomodado, agitado e pediu para ir embora. Esse é o primeiro sinal que ele dá quando não está legal, o corpo dele começa a falar”.Foi nesse momento que a mãe viu no telão do estádio um aviso com o telefone de contato da Arena para auxiliar torcedores e enviou uma mensagem para saber se havia alguma alternativa para que não precisassem ir embora sem assistir a partida. Joyce afirmou que ficou muito surpresa com a velocidade que foi atendida e com a existência de um espaço específico para receber pessoas com TEA.“Rapidamente localizaram a gente na arquibancada e nos levaram até a sala. Achei sensacional a iniciativa, meu filho ficou apaixonado com o espaço, tirou os sapatos e logo começou a brincar. O barulho lá era 90% menor do que na área externa e conseguimos acompanhar o jogo até o final com tranquilidade”.O espaço TEA da Arena Corinthians tem capacidade para até 160 pessoas. Cada família pode comprar até 4 ingressos para assistir ao jogo no local, depois de se inscrever através do site. Segundo André Luiz Oliveira, diretor administrativo do clube, a sala foi sendo adaptada conforme as necessidades desses grupos. Lá as famílias vão encontrar televisões com programação infantil, brinquedos, figuras para serem coloridas e até emojis que expressam diferentes emoções e podem ajudar pessoas com grau mais elevado de autismo a se comunicar.“Temos um departamento de responsabilidade social e começamos a observar que precisávamos de um espaço preferencial para que essas pessoas pudessem frequentar o estádio. O espaço está dando muito certo e o importante para nós é integrar cada vez mais pessoas e alcançar mais torcedores”, afirmou Oliveira.Depois da boa experiência no estádio, Joyce decidiu compartilhar o caso em uma rede social e a história viralizou. Mais de 50 mil pessoas curtiram e mais de 40 mil compartilharam a publicação. Segundo Joyce, com a repercussão, muitas mães com filhos portadores de autismo começaram a tirar dúvidas sobre espaços preparados para recebê-los e ela se viu motivada a criar uma página para falar especialmente sobre isso. “É um tabu muito grande falar sobre o autismo e muitos lugares não são preparados. Na verdade, deveria ser obrigatório ter esses espaços para receber as pessoas, o lazer é um direito constitucional. Se o meu filho gosta de futebol, porque não levá-lo para o estádio? Precisamos falar mais sobre isso e incentivar cada vez mais a socialização deles”, concluiu.",2019-12-01,https://epoca.globo.com/sociedade/desconfortavel-com-barulho-do-estadio-menino-autista-recebe-ajuda-em-partida-na-arena-corinthians-24109607
Mundial de Clubes: o que Jorge Jesus fez pelo Al Hilal,"Jorge Jesus fartou-se de dizer nas últimas semanas que ""montou todo o Al Hilal"", time saudita que pode ser adversário do Flamengo na semifinal do Mundial de Clubes. Entre os árabes, a reação à declaração foi de certa surpresa, uma sensação de que o técnico do Flamengo se atribuiu, digamos, um mérito excessivo. É possível compreendê-los. Afinal, apenas dois dos habituais titulares do time chegaram ao Al Hilal durante a curta passagem de sete meses de Jorge Jesus pelo clube. E até taticamente o time foi bastante transformado após sua saída.Mas também é verdade que, individualmente, Jesus marcou bastante alguns jogadores da equipe saudita. As referências a ele lembram sua forma intensa de trabalhar e contribuições às carreiras de cada atleta. É exagero, no entanto, dizer que se verá em campo um Al Hilal construído por Jorge Jesus. Quando ele assumiu o clube, de cinco a seis jogadores da base titular já iniciavam jogos com frequência havia ao menos um ano. Outros, já tinham cinco a seis anos de clube.Em sua passagem, somente o francês Bafétimbi Gomis e o peruano André  Carrillo foram contratados, com participação de Jesus. O italiano Sebastian Giovinco, outro nome de peso do elenco, teve sua contratação definida enqunato o técnico português saía, enquanto o zagueiro coreano Jang Hyun-Soo foi contratado seis meses depois.""É importante dizer que este time tem um histórico de chegar a várias finais asiáticas. Isto é o trabalho de muitos treinadores. Se falarmos de um, teremos que falar de todos. Mas se ele (Jesus) está dizendo que montou o time, então vamos agradecer. Mas também olhar o trabalho de outros e dizer o mesmo"", afirmou, com ironia, o romeno Razvan Lucescu, terceiro treinador do Al Hilal desde a saída de Jesus.O Al Hilal deve enfrentar o Ésperance, da Tunísia, hoje com meio time diferente da última escalação de Jesus. Três jogadores escalados pelo português em seu último jogo, em janeiro passado, nem estão mais no clube. Mudou também a forma de jogar: o jeito intenso do treinador do Flamengo, que gosta de pressão no rival e ataques construídos em poucos toques, deu lugar a um time mais cadenciado. ""Continuamos ofensivos, mas a forma de atacar mudou bastante. Ele introduziu coisas no clube, como a presença de um nutricionista junto à equipe e um trabalho mais especializado de prevenção de lesões"", conta Carlos Eduardo.Mas é o estilo intenso e detalhista, tão notado em sua passagem atual pelo Flamengo, que ficou na memória dos jogadores: ""Ele é um grande treinador. É fato que tem sua maneira de trabalhar, de repetir jogadas, fazer reuniões que por vezes são muito longas. Como um professor, ele te explica o futebol de A a Z. Isso é bom, especialmente para mim. Mesmo na minha idade, aprendi muito"", disse o atacante francês Gomis, de 34 anos. Em relação a Carrillo, a convivência com Jesus não se limitou aos sete meses de Al Hilal. Ele já trabalhara com o hoje condutor rubro-negro por um ano no Sporting, de Portugal. ""Não é por acaso que ganhou tudo no Flamengo. Seu jeito exigente e detalhista na parte tática é característico. No campo, é um louco pelo futebol"", analisou o meia.É possível se perguntar, portanto, as razões para que tenha sido tão curta a relação entre Jorge Jesus e o Al Hilal. E o curioso é que os motivos da ruptura são uma repetição exata da situação que o português vive no Flamengo. Em janeiro, o treinador cumprira pouco mais da metade do contrato de um ano. O Al Hilal, no entanto, queria que Jesus renovasse até o fim de 2019, para tê-lo em toda a temporada. O treinador não aceitou e o clube preferiu dispensá-lo.A diferença é que o Flamengo, ao que parece, pretende ficar com ele até o meio de 2020, mesmo sem a garantia de permanência. Mesmo que Jesus repita a postura de não antecipar uma renovação de contrato na virada do ano. No meio de 2020, é possível que muitas portas se abram para o técnico, em especial pelo fim da temporada europeia.Leia também:",2019-12-14,https://epoca.globo.com/mundial-de-clubes-que-jorge-jesus-fez-pelo-al-hilal-24137994
Sogros de Messer transportaram dinheiro de ex-presidente do Paraguai,"Durante 15 meses como foragido, Dario Messer se manteve escondido em endereços no Brasil e no Paraguai com o suporte de um grupo composto de autoridades e parentes de sua noiva.Desta forma, o doleiro obteve abrigo e dinheiro para seguir longe do radar das autoridades.De acordo com o Ministério Público Federal (MPF), este núcleo de apoio a Messer era liderado por sua noiva, a advogada Myra de Oliveira Athayde. Ela mobilizou também a própria mãe, a médica Alcione Maria Mello de Oliveira Athayde, e seu padrasto, o psicólogo Arleir Francisco Bellieny.Segundo o MPF, Myra e sua família se encarregavam de “implementar o transporte e o recebimento dos recursos financeiros ocultos”. Os três foram presos há uma semana durante a Operação Patrón, mais um desdobramento da Lava Jato no Rio de Janeiro.No relatório do MPF, os procuradores afirmam que materiais apreendidos ao longo das investigações demonstram que Horácio Cartes, ex-presidente do Paraguai, teria disponibilizado US$ 500 mil a Dario, a quem chamava de “irmão de alma”.Com doleiros paraguaios de sua confiança, Dario combinou, por meio de mensagens de telefone, estratégias para que este valores fossem fracionados e encaminhados a ele de acordo com a necessidade. O dinheiro foi transferido para uma conta em nome de Myra em um banco do Paraguai, entre janeiro e abril de 2019. Um dos depósitos, realizado em 20 de janeiro, é de US$ 260 mil dólares.Extratos e conversas localizados nos celulares de Dario mostram também que mãe e padastro de Myra receberam repasses dos doleiros paraguaios deste crédito disponibilizado por Horácio Cartes.Um áudio obtido pelos procuradores indica que a médica orientava sua filha e ressaltava a necessidade de não deixar nenhuma quantia na conta do Paraguai.Nas fotos obtidas no celular de Messi, também ficou demonstrado que um dos doleiros efetuou duas entregas de valores à mãe de Myra.Já o padrasto teria ido a Assunção, no Paraguai, ao menos duas vezes, em junho e julho, ficando no país apenas um dia em ambas as viagens.“Em suma, Myra, ao que parece, está intimamente ligada à organização criminosa dos doleiros, e teria participado ativamente das situações de ocultação de capital, envolvendo, inclusive, seus familiares”, afirma o juiz Marcelo Bretas, da 7a Vara Federal Criminal, em um dos seus despachos.Mauro Tse, advogado da mãe e do padrasto de Myra, nega qualquer envolvimento de Alcione e Arleir: “Meus clientes fazem parte de esquema criminoso algum. Eles são mãe e padrasto de Myra, companheira, e não operadora de Dario Messer”.Já Átila Machado, advogado Myra, disse a ÉPOCA que vai se manifestar “em momento oportuno durante o curso do processo comprovando a inocência de seus clientes, à semelhança do que ocorreu em processos anteriores” relacionados a Dario Messer. “Reputamos ilegal e arbitrário o decreto de prisão preventiva e estamos adotando as medidas legais para revogá-lo.” O MPF aponta que Dario Messer e a organização criminosa liderada por ele estão relacionados a crimes de lavagem de dinheiro, sonegação de impostos e evasão de divisas. O doleiro é acusado de beneficiar políticos, jogadores de futebol, empresários e artistas, entre outros clientes em operações ilegais.Messer é acusado de movimentar mais de R$ 6 bilhões, valor associado a mais de 3 mil offshores, cujas contas se dividiam em 52 países. Ele foi preso em São Paulo, em 31 de julho passado, no apartamento que dividia com Myra Athayde.Leia também:",2019-11-26,https://epoca.globo.com/brasil/sogros-de-messer-transportaram-dinheiro-de-ex-presidente-do-paraguai-24101345
O que o Flamengo pode fazer para superar o Liverpool,"Quatro horas e meia antes de enfrentar o Liverpool no Estádio Khalifa Internacional, em Doha, no Catar, o Flamengo fez um treino fechado para a imprensa. A estratégia é uma das marcas que Jorge Jesus trouxe às partidas nestes seis meses recém-completados no clube e algo que raramente se vê no futebol brasileiro.Para o jogo mais importante do ano, o técnico português poderá repetir parte do repertório que apresentou no período, e que levou o rubro-negro a conquistar o Brasileiro e a Libertadores. ÉPOCA listou algumas dessas táticas. Confira a lista:O latereioDentre as jogadas de bola para, há uma que se inicia no lateral. Normalmente pela esquerda, Filipe Luis cobra para Rodrigo Caio, que se posiciona próximo da linha de fundo, do lado direito do gol. A ideia é arrematar para os atacantes que chegam na área finalizarem direto, ou tocarem para alguém melhor posicionado. Foi assim que o time marcou um gol sobre o Ceará, no Brasileiro, de autoria de Pablo Marí.O escateioA jogada de escanteio também é um ponto forte do Flamengo. Com Arrascaeta pelo lado esquerdo, e Éverton Ribeiro no canto oposto, a cobrança vem fechada, e prioriza a primeira trave. Onde normalmente aparecem os zagueiros e o volante Willian Arão. Foi assim contra Grêmio, na Libertadores, e Atlético-MG, no Brasileiro, por exemplo. Normalmente, Gabigol aparece na segunda trave, para aproveitar um desvio.  A inversão de posiçõesA troca de posições dos jogadores de ataque é uma das principais armas do Flamengo com a bola em movimento. Normalmente, o quarteto formado por Éverton Ribeiro, Arrascaeta, Bruno Henrique e Gabigol alternam os lados e executam movimentos sincronizados para abrir espaço para entrar na área e finalizar. Jorge Jesus costuma treinar todas essas variações levando em conta os momentos em que o time tem a bola. Contra o Al-Hilal, por exemplo, Gabriel abriu pela direita, tocou para Bruno Henrique mais por dentro, e ele rolou para Arrascaeta, que chegada pela esquerda, marcar.A subida de RafinhaA participação de Rafinha no ataque torna o lado direito do Flamengo mais perigoso em diversas situações. É o lateral campeão do mundo que costuma triangular com meias e atacantes e fazer o time ter superioridade numérica para concluir as jogadas do lado para o centro da áerea. Foi assim na assistência para Bruno Henrique também na semifinal contra o Al-Hilal.Cobranças de faltaRafinha também é figura importante em jogadas ensaiadas. Normalmente em cobranças de falta, ele surge como opção surpresa para receber o lançamento e converter um passe para gol com a defesa adversária desatenta. A movimentação prevê saída de trás da linha da bola, em direção à linha de fundo. Dali, livre, faz o passe para trás em busca de pelo menos três atacantes - Arrascaeta, Bruno Henrique e Gabigol.",2019-12-21,https://epoca.globo.com/o-que-flamengo-pode-fazer-para-superar-liverpool-24152315
"As lutas de Megan Rapinoe, dentro e fora de campo","Da bancada da CNN, no programa Anderson Cooper 360°, Megan Rapinoe foi instada pelo apresentador a mandar uma mensagem para o presidente dos Estados Unidos, Donald Trump. Após um leve suspiro, olhou diretamente para a câmera e deu seu recado: “Sua mensagem está excluindo as pessoas. Você está me excluindo. Você está excluindo pessoas como eu. Você está excluindo pessoas de cor. Você está excluindo americanos que talvez o apoiem”.Essa é a cocapitã do Estados Unidos — divide o posto com Alex Morgan e Carli Lloyd —, uma das artilheiras da Copa do Mundo da França, autora de um dos gols da final contra a Holanda e eleita a craque do torneio. Títulos que lhe conferem moral suficiente para bater de frente com Trump e negar seu convite à Casa Branca, certo?Não. Há anos Rapinoe bate de frente com quem quer que seja na defesa por igualdade. A dimensão tomada pelo Mundial feminino, que teve recordes de audiência pelo mundo e foi assunto na mídia e nas redes sociais por mais de um mês, só tem feito sua voz reverberar mais longe. Hoje, o planeta reconhece as madeixas levemente arroxeadas, concordando ou não com suas posições políticas.A atacante, de 34 anos, decidiu que sua voz tinha potência após se assumir gay em 2012. Naquele ano, conquistara o ouro olímpico em Londres. Ali já se tornava uma das principais jogadoras do time, que venceria dois títulos mundiais seguidos, e a elevaria ao status atual.Ganhou força para que sua declaração a um site voltado ao público gay fosse amplamente repercutida. Sua intenção era clara. Não se tratava apenas de um desabafo. Mas da pavimentação do caminho para que outros fizessem o mesmo.“Sinto que os esportes em geral ainda são homofóbicos, no sentido de que poucas pessoas são assumidas. Eu sinto que todo mundo está realmente desejando que as pessoas se assumam. As pessoas querem — precisam — ver que há pessoas como eu jogando futebol pelos bons e velhos Estados Unidos da América”, afirmou na mesma ocasião em que também revelou seu namoro de um ano com a jogadora australiana Sarah Walsh.Formada em sociologia e ciências políticas pela Universidade de Portland, a californiana de uma família de seis filhos — tem uma irmã gêmea, Rachel —, não se importa em transformar a seleção em palanque. Antes mesmo da ascensão de Trump ao poder, lá estava ela repetindo o gesto do jogador de futebol americano, então no San Francisco 49ers, Colin Kaepernick.Em 2016, ele se recusou a ficar de pé durante a execução do Hino Nacional americano em forma de protesto pelas mortes de negros pelas mãos de policiais. Rapinoe fez o mesmo durante um jogo da seleção. Foi repreendida e o ato proibido pela Confederação Americana de Futebol, a US Soccer.Ela manteve o protesto de outra forma. Não canta o Hino Nacional nem coloca a mão no peito como as demais jogadoras.“Eu não vivi excessos da polícia, discriminação racial, brutalidade policial, nem vi um membro da família morto na rua. Mas não posso ficar de braços cruzados enquanto há pessoas neste país que tiveram de lidar com isso. Eu posso entender se pensam que estou desrespeitando a bandeira ao me ajoelhar, mas é por causa de meu maior respeito pela bandeira e pela promessa que ela representa que escolhi demonstrar dessa maneira”, declarou à época.Os posicionamentos de Rapinoe geram, claro, muita controvérsia. Nas redes sociais, ela é bombardeada com mensagens homofóbicas. Ou, no mínimo, quem admira seu futebol considera algumas atitudes desrespeitosas. Como não cantar o Hino.Nada a melindra, no entanto. Na Copa do Mundo afirmou que não seria possível ganhar um campeonato sem gays no time. “Isso jamais foi feito antes na história, nunca. Isso aí é ciência pura!”O forte ativismo a faz ser o famoso rosto do esporte na luta pela equidade de gênero e direitos LGBTQI+. Defende inúmeras organizações e foi homenageada por algumas delas. Recebeu prêmio do Conselho de Administração pelo Centro de Gays e Lésbicas de Los Angeles, por se tornar uma atleta gay de alto nível e entrou para o hall da fama americano dos esportistas gays e lésbicas. Tem até um dia próprio em sua homenagem. Sua cidade natal, Redding, reconhece o dia 10 de setembro como o Megan Rapinoe Day desde 2011, após o vice-campeonato mundial.A militância ferrenha de Rapinoe abre caminho para a naturalização de ser gay num ambiente esportivo. Cenas como a da lateral Kelley O’Hara, que nunca se declarou publicamente homossexual, indo à arquibancada beijar sua namorada são fruto disso.A luta de Rapinoe pela igualdade a faz transitar por diversas bandeiras. Há anos levanta uma das mais difíceis. Conseguir que as jogadoras da seleção tenham os mesmos ganhos financeiros que os homens. Apesar do tetracampeonato mundial, dos títulos olímpicos, da maior visibilidade e do maior lucro, elas ainda recebem menos que eles.Segundo auditoria da US Soccer, de 2016 a 2018, a seleção feminina gerou US$ 50,8 milhões à confederação. No mesmo período, a masculina somou US$ 49,9 milhões. Mas elas receberam quase um terço a menos pelas vitórias. A bandeira virou caso de Justiça e elas entraram com ação por equiparação salarial.O objetivo de Rapinoe é que a confederação americana replique práticas de países que estão na vanguarda desse movimento. Em 2017, a Noruega igualou os salários das seleções masculina e feminina. Para isso, dobrou a remuneração das mulheres e reduziu a dos homens — com a concordância deles. No ano passado, foi a vez de a Nova Zelândia igualar os salários de suas duas seleções.Rapinoe quer ampliar agora apoios a sua causa. Ela aceitou o convite para visitar o Congresso e conversar com as democratas Nancy Pelosi e Alexandria Ocasio-Cortez. “É o momento de levar nossas questões a outros níveis”, afirmou.",2019-07-11,https://epoca.globo.com/esportes/as-lutas-de-megan-rapinoe-dentro-fora-de-campo-23799185
