Título,Notícia,Data,Link
Como será o mercado do futebol após a pandemia?,"Presos em casa e obrigados a ver um sem-fim de jogos reprisados, os fãs do futebol podem ter certeza de que a volta dos campeonatos, quando acontecer, será sob uma nova realidade. Dirigentes, empresários e jogadores estão convictos de que o novo normal do futebol será um mercado de transferências internacionais em baixa, o que muda completamente a vida de clubes — aqui e no exterior.A recessão econômica, que o Fundo Monetário Internacional (FMI) prevê como a pior em quase 100 anos, não vai deixar ninguém imune. Sem tanto dinheiro em caixa, os clubes europeus deverão reduzir os valores oferecidos por jogadores tanto no mercado dos consagrados que já jogam a Liga dos Campeões quanto no dos jovens importados da América Sul, uma péssima notícia para os clubes brasileiros, dependentes das transferências para fechar as contas.É cada vez maior o consenso em torno de que, enquanto a economia global estiver encolhendo, serão raras as transações de nove dígitos e de que, sem as grandes vendas, o mercado todo tende a perder. Quando um clube recebe uma quantia muito alta por um atleta, geralmente, sai logo comprando outros jogadores. Depois de embolsar € 222 milhões pela venda de Neymar para o PSG em 2017, o Barcelona tirou Philippe Coutinho do Liverpool e Antoine Griezmann do Atlético de Madrid, criando um efeito cascata que foi longe. “Sem essas grandes negociações acima de € 100 milhões, não há efeito do topo da pirâmide para a base”, disse Pedro Daniel, diretor executivo da consultoria Ernst & Young.Nessa nova conjuntura, não está descartada a hipótese de que os clubes brasileiros se vejam forçados a vender mais atletas, o que, à primeira vista, pode parecer uma contradição. Num mercado que está pagando menos, faria sentido esperar para vender mais caro quando os preços subirem. O problema, porém, é que os clubes brasileiros não têm caixa para esperar a conjuntura mudar. O mais provável é que vendam mais jogadores para fazer receita. “Os clubes brasileiros terão de rever seus orçamentos. O patamar de preços, mesmo para os jovens, tinha subido muito nos últimos tempos”, avaliou Eduardo Uram, um dos agentes de jogadores mais atuantes do país. Gabigol deverá sair do Flamengo? Igor Gomes tem os dias contados no São Paulo? Ninguém sabe dizer quais jogadores os clubes vão querer vender e se haverá demanda por eles.O certo é que nenhum time está em situação totalmente tranquila. Nem Flamengo, nem Palmeiras, líderes de arrecadação no país. No caso do atual campeão brasileiro, até houve um esforço recentemente para melhorar as finanças, com redução do endividamento e tentativa de equilíbrio nas contas. Mas o clube segue sendo dono de um dos elencos mais caros. Para os dirigentes, a recente desvalorização do real é outro fator de preocupação. Além da perspectiva de transferências menores em euros e dólares, a cotação do real ante as duas moedas vem caindo. “Os valores vão mudar, inclusive para jogadores top. Haverá menos dinheiro circulando e os clubes, até os de melhor situação, vão sentar à mesa ao receberem qualquer proposta”, disse Anderson Barros, executivo de futebol do Palmeiras.Para os demais grandes clubes do Rio de Janeiro e de São Paulo e os de Minas Gerais e do Rio Grande do Sul, o cenário também é de bilheterias em queda, possível renegociação de patrocinadores e projetos de sócio-torcedor com viés de baixa. “É possível que demore para vermos os valores astronômicos de TV e marketing que tínhamos até antes da pandemia”, disse César Grafietti, consultor de gestão e finanças do esporte.“Gabigol deverá sair do Flamengo? Igor Gomes tem os dias contados no São Paulo? Ninguém sabe ainda. O certo é que os clubes brasileiros enfrentarão uma pressão financeira histórica”Hoje até a saída chinesa está em xeque. A China se consolidou nos últimos anos como um destino de jogadores de porte médio — aqueles que nunca seriam titulares nos melhores times espanhóis nem ingleses, mas são destaques no Brasileirão. “A questão da China amedronta. Eles terão uma janela de transferências agora? Não se sabe”, disse um dirigente de clube brasileiro que preferiu não revelar o nome.Assim como no Brasil, na Europa há uma queda de braço entre ligas e governos pela retomada das competições. Para os clubes europeus, o ano contábil habitualmente termina em 30 de junho, com o fim das temporadas. É quando as vendas de jogadores são usadas para equilibrar balanços e satisfazer regras do Fair Play Financeiro da Uefa (sigla da Union of European Football Associations). A transição de um ano esportivo para outro também traz receitas extras de patrocinadores, bônus e vendas de ingressos para o ano seguinte. Como não há fim de temporada nem perspectiva de início de outra, cria-se um vácuo de receitas.Ao fim desta temporada — seja lá quando isso acontecer —, vários jogadores importantes vão encerrar seus contratos, tornando-se “agentes livres”. Nomes como David Silva, Cavani, Thiago Silva e Götze estarão nesse grupo. Em circunstâncias normais, seria um dos últimos momentos da carreira para fazer uma grande quantidade de dinheiro numa transação. Sem precisar pagar pela rescisão de contrato, o novo clube remunera o atleta dono de seu destino com altas somas a título de luvas ou prêmio pela assinatura do novo compromisso. Com a pandemia, nem craques consagrados têm alguma certeza sobre o que vai acontecer.PERSONAGENS DA SEMANAOS ANTIDEMOCRÁTICOSVários pequenos grupos de apoiadores do presidente Jair Bolsonaro se radicalizam e fazem ameaças às instituiçõesHERÓIS DE MÁSCARADIÁRIO DE DENTRO DE UMA UTI PÚBLICAAs vitórias e os dissabores da médica Bruna Villela, que se isolou da família por dois meses para se dedicar a salvar vidas de vítimas da Covid-19SAÍDA PELO AEROPORTOA FUGA DE BELÉMOs ricos do Pará pegam jatinhos para buscar ajuda médica em São PauloVIVI PARA CONTARO CIENTISTA CONTRA AS FAKE NEWSO médico líder da pesquisa sobre a cloroquina vira alvo de lobistas e da extrema-direita nas redes sociais ao contrariar eficiência do remédioCONCORDAMOS EM DISCORDARMARGARIDA GUTIERREZ × ALEX AGOSTINIOs economistas divergem sobre a ideia de o governo imprimir dinheiro para financiar suas contas, agora pressionadas pelo socorro a empresas e vulneráveisDENTRO DAS QUATRO LINHASO GOL CONTRA DO VÍRUSA pandemia afeta as transferências internacionais de jogadores numa mudança histórica no esporte17 PERGUNTAS PARA...LYA LUFTA escritora fala sobre o novo livro, As coisas humanas, e a perda do filho AndréO ETERNO COOLO QUE RESTARÁ DO JAZZA morte de grandes nomes da música em meio à pandemia deixa um vácuo difícil de ser preenchidoVERDADEIRO BRILHANTEGLOSSÁRIO DO ALDIRDe A a Z, os versos do compositor que fizeram históriaFICÇÃO TRANSPORTADAPHILIP ROTH E O BRASIL DE BOLSONAROA série “Complô contra a América”, inspirada em livro do escritor americano, lembra a atmosfera opressiva que estamos vivendoColunistasGuilherme AmadoO ódio como métodoMonica de BollePor que precisamos de bancos?Helio GurovitzPor que perdemos as batalhas para o vírusAllan SieberLarry RohterAquele abraço",2020-05-08,https://epoca.globo.com/esportes/como-sera-mercado-do-futebol-apos-pandemia-1-24416367
Estudante faz sucesso imitando locutor de futebol para narrar isolamento da família,"O estudante de Direito Áureo Deni, de 21, viralizou nas redes sociais ao criar uma maneira divertida para driblar o tédio da quarentena do coronavírus e, ao mesmo tempo, fazer com que seus pais e avós ficassem em casa: narrar, como um locutor esportivo, o dia a dia da família.O primeiro vídeo, postado em sua conta no Instagram (@aureo_deni), já teve mais de 100 mil visualizações e ganhou continuações.Áureo, que vive em Natal, no Rio Grande do Norte, faz estágio na Defensoria Pública da União e é cantor nas horas vagas em bares da capital potiguar.Com o início da quarentena, parou de fazer shows e trabalha de casa.",2020-04-22,https://epoca.globo.com/sociedade/estudante-faz-sucesso-imitando-locutor-de-futebol-para-narrar-isolamento-da-familia-24387262
"Artigo | No mundo pós-pandemia, clube-empresa será a única saída para times","Nada será como antes. Temos uma oportunidade ímpar para virar o jogo, em vários aspectos da sociedade e da economia, inclusive no futebol. No livro “The Great Leveller”, Walter Scheidel, Professor de Stanford, ressalta que doenças, guerras e epidemias são catalizadores de transformações profundas e somente nestes fenômenos reduz-se desigualdades sociais. Outro livro que reforça a teoria é “Guns, Germs and Steel”, que rendeu o Pulitzer ao historiador e antropólogo Jared Diamond.Na Inglaterra, mesmo na crise, investidores estão comprando o Newcastle por £ 300 milhões. O Brasil é o maior exportador de jogadores do mundo, mais de mil por ano, e não recebe nenhum investimento. Até brasileiros preferem investir no exterior, como é o caso do Ronaldo no Valladolid e do Flávio Augusto no Orlando City.Segundo a EY, clubes brasileiros poderão deixar de arrecadar R$ 2 bilhões em 2020. O futebol brasileiro estava no grupo de risco do novo coronavírus, cheio de comorbidades: arquitetura institucional arcaica, estrutura de governança obsoleta, modelo de gestão ineficiente e crise de liquidez beirando a insolvência. A suspensão dos jogos e os efeitos econômicos da pandemia no arranjo produtivo e no poder de compra dos torcedores só aceleram a tendência na direção da bancarrota.Todas atividades econômicas precisarão de ajuda dos governos para sobreviver, como está a ocorrer em todo mundo. O futebol também. A diferença é que no caso brasileiro isso deve passar por mudanças estruturais. Entre os dez maiores mercados do futebol mundial, o Brasil é o único que não tem liga nem clube empresa.Empresas vão à falência, bens são leiloados e paga-se o possível a credores. Nos Estados Unidos, a USA Rugby pediu recuperação judicial por causa da pandemia. Se não se recuperar, encerra atividades, paga o que puder e a modalidade recomeça em nova entidade. Por que carregar eternamente um passivo que impede o desenvolvimento pleno da atividade e prejudica o país inteiro?A virada começa em alternativas que permitam conciliar saúde, esporte e economia. É preciso participar do esforço mundial na busca de medidas que resguardem a integridade dos atletas, demais profissionais e torcedores.As soluções de saúde certamente desembocarão em aumentar o uso da tecnologia, inclusive com redes sociais levando os torcedores para dentro dos campos, do vestiário, das academias, para a vida do seu clube. O faturamento dos clubes que em muito já tinha passado dos estádios para televisão e para lojas franquiadas, começará a vir cada vez mais da internet.Clubes transformados em empresas terão ações em bolsas de valores e até mesmo os direitos econômicos dos jogadores precisam ser estruturados como ativos financeiros nos mercados de capitais para atrair investimentos de fãs e investidores. Tudo isso começa por contabilidade crível e auditada e um padrão de gerenciamento eficiente e transparente como nos demais negócios de uma economia madura.Só que para chegar a esse maravilhoso novo mundo, é preciso sobreviver à pandemia. Com os efeitos da crise nos patrocinadores, na TV e no público dos estádios, o governo precisará implementar políticas públicas inteligentes para que o futebol brasileiro se modernize.Se clubes já fossem empresas, praticamente  90% dos jogadores brasileiros, que recebem até dois salários mínimos, estariam contemplados nessa linha de crédito emergencial que o Governo lançou para financiar a folha de pagamento das empresas pelos próximos dois meses. Quanto à minoria dos jogadores que chegaram a elite do futebol, inclusive mundial, com rendas bilionárias: podem sacar de suas poupanças para o consumo básico que se consegue usufruir durante a quarentena e ainda continuarão milionários.Aliás, vale ressaltar que diversos jogadores tem demonstrado extrema consciência social com ações solidárias nesse momento tão delicado. Os ingleses esperam arrecadar mais de £ 4 milhões (#PlayersTogether) para o Serviço Nacional de Saúde, os da Juventus renunciaram a quatro meses de salário, economizando € 90 milhões para o clube, os do Benfica doaram mais de € 1 milhão para o combate à pandemia, os do Barcelona cortaram seus salários em 70% para que outros funcionários do clube recebessem integralmente.A letargia para tomar medidas emergenciais aumenta o problema. A Federação Espanhola de Futebol estruturou linha de crédito de quase R$ 3 bilhões para clubes das 1ª e 2ª divisões. Os maiores clubes alemães criam um fundo de solidariedade na Bundesliga com mais de R$ 100 milhões.No Brasil, o Governo pode, por exemplo, apoiar à cadeia produtiva do futebol via BNDES, como faz com o Fundo Setorial do Audiovisual, que já investiu mais de R$ 200 milhões, o BNDES Saúde, que financia a modernização da gestão, da governança e da eficiência operacional, visando à sustentabilidade econômico-financeira de instituições filantrópicas e o Fundo Social, que prevê investimentos em desportos. Recursos das loterias, que nos últimos 5 anos destinaram R$ 427 milhões aos clubes de futebol, poderiam ser antecipados, desde que desvinculados dos financiamentos que garantem atualmente. A FINEP pode viabilizar investimentos para estruturação dos clubes em empresas e dos projetos a serem apresentados ao BNDES, como due diligence contábil e jurídica, estudos de viabilidade econômica etc.O Congresso pode aprovar legislação favorável ao Clube-Empresa, como o “PL Pedro Paulo”, em tramitação no Senado depois de aprovado quase por unanimidade na Câmara, e aprimorar as Leis de Incentivo, como defende o “PL Alcino Rocha”, que facilita doações de pessoas físicas em até R$ 6 bilhões/ano.Os clubes podem criar a liga e melhorar o ambiente de negócios do futebol brasileiro, com mecanismos coletivos para garantir sua saúde financeira. Também podem securitizar recebíveis como sócio-torcedor, que subiram mais de 40% nos últimos 5 anos, ultrapassando R$ 400 milhões/ano.A CBF pode estruturar uma linha de crédito e fomento para clubes e articular junto à FIFA a regulamentação do investimento em direitos econômicos de jogadores para atrair recursos novos, a exemplo do que ocorria até 2015. Esses são apenas alguns exemplos que poderiam ajudar o futebol a sair mais forte dessa crise. Cada um só precisa cumprir o seu papel.Essa é hora crucial para futebol brasileiro. O foco das ações devem ser remediar o curto prazo e garantir a sobrevivência do ecossistema do futebol. A crise deve alertar para os problemas fundamentais e evidenciar a necessidade de aprofundamento da discussão técnica em todos os níveis decisórios, passando pelos clubes, confederações e governo. Vamos virar esse jogo.",2020-05-03,https://epoca.globo.com/artigo-no-mundo-pos-pandemia-clube-empresa-sera-unica-saida-para-times-1-24407969
Máscaras e mingau: como o mundo tentou conter a pandemia da gripe espanhola em 1918,"É perigoso traçar muitos paralelos entre o coronavírus e a pandemia de gripe espanhola de 1918, que matou pelo menos 50 milhões de pessoas em todo o mundo.A covid-19 é uma doença totalmente nova, que afeta desproporcionalmente as pessoas mais velhas. A gripe que varreu o mundo em 1918 tendia a atingir aqueles com idades entre 20 e 30 anos, com fortes sistemas imunológicos.Mas as ações tomadas por governos e indivíduos para impedir a propagação da infecção têm similaridades.A agência de saúde pública da Inglaterra (Public Health England) estudou o surto de gripe espanhola para elaborar seu plano inicial de contingência para o novo coronavírus. A lição principal é que a segunda onda da doença, no outono de 1918, foi muito mais mortífera que a primeira.O país ainda estava em guerra quando o vírus fez sua primeira vítima registrada, em maio de 1918. O governo do Reino Unido, como muitos outros, parece ter decidido que o esforço de guerra viria antes da prevenção de mortes por gripe.A doença se espalhou rapidamente nas tropas e nas fábricas de munições, além de ônibus e trens, de acordo com um relatório de 1919 de Arthur Newsholme para a Royal Society of Medicine.Mas um ""memorando para uso público"" que ele escreveu em julho de 1918, que aconselhava as pessoas a ficar em casa se estivessem doentes e a evitar grandes reuniões, foi ignorado pelo governo.Newsholme argumentou que muitas vidas poderiam ter sido salvas se essas regras fossem seguidas, mas acrescentou: ""Existem circunstâncias nacionais em que o principal dever é 'continuar', mesmo quando há risco à saúde e à vida"". Em 1918, não havia tratamentos para a gripe e nem antibióticos para tratar complicações como pneumonia. Os hospitais ficaram rapidamente sobrecarregados.Não havia um bloqueio imposto centralmente para conter a propagação da infecção, embora muitos teatros, casas noturnas, cinemas e igrejas estivessem fechados, em alguns casos por meses.Os pubs, que já estavam sujeitos a restrições de horário de guerra no funcionamento, geralmente ficavam abertos. As competições de futebol Football League e FA Cup foram canceladas devido à guerra, mas não houve esforço para cancelar outras partidas ou limitar as multidões, com equipes masculinas jogando em competições regionais e o futebol feminino, que atraiu grandes multidões, continuou durante toda a pandemia.Ruas em algumas vilas e cidades foram borrifadas com desinfetante e algumas pessoas usavam máscaras, enquanto seguiam suas rotinas.As mensagens de saúde pública eram confusas - e, como hoje, as notícias falsas e as teorias da conspiração eram abundantes, embora o nível geral de ignorância sobre como levar uma vida saudável não tenha ajudado.Em algumas fábricas, as regras para não fumar eram relaxadas, na crença de que os cigarros ajudariam a prevenir a infecção.Durante um debate parlamentar sobre a pandemia, o deputado conservador Claude Lowther perguntou: ""É verdade que uma forma de prevenção contra a gripe é ingerir cacau três vezes ao dia?"".Campanhas publicitárias e folhetos alertaram contra a propagação de doenças através de tosses e espirros.Em novembro de 1918, o News of the World, jornal britânico em formato tabloide, aconselhava seus leitores a ""lavar o nariz com água e sabão todas as noites e manhãs; forçar-se a espirrar de noite e de manhã, depois respirar profundamente.""Recomendava, ainda, voltar caminhando do trabalho para casa e comer bastante mingau.Nenhum país ficou intocado pela pandemia de 1918, embora a escala de seu impacto e os esforços do governo para proteger suas populações tenham variado muito.No Brasil, não há uma contabilização exata das vítimas, mas a estimativa é que cerca de 35 mil pessoas morreram no país devido à gripe espanhola. Os relatos são de que o Rio de Janeiro, então capital do país, parou completamente.Nos Estados Unidos, alguns Estados impuseram quarentenas a seus cidadãos, com resultados variados, enquanto outros tentaram tornar obrigatório o uso de máscaras faciais. Cinemas, teatros e outros locais de entretenimento foram fechados em todo o país.Nova York estava mais preparada do que a maioria das cidades dos EUA, já tendo passado por uma campanha de 20 anos contra a tuberculose. Como resultado, teve uma menor taxa de mortalidade.No entanto, o comissário de Saúde da cidade ficou sob pressão das empresas para manter tudo aberto, principalmente os cinemas e outros locais de entretenimento.Estar ao ar livre era visto como algo benéfico contra a propagação de infecções, levando a algumas soluções engenhosas para manter a sociedade em movimento.Mas foi impossível impedir reuniões em massa em muitas cidades dos EUA, principalmente em locais de culto. Ao fim da pandemia, o número de mortos na Grã-Bretanha era de 228 mil, e acredita-se que um quarto da população tenha sido infectada.Os esforços para deter o vírus continuaram por algum tempo, e a população ficou mais consciente do que nunca da natureza potencialmente mortal da gripe sazonal.Todas as fotografias têm direitos autorais.",2020-05-08,https://epoca.globo.com/mundo/mascaras-mingau-como-mundo-tentou-conter-pandemia-da-gripe-espanhola-em-1918-24417424
"Premiada por desempenho, enfermeira de Manaus viaja a Portugal e é impedida de voltar ao Brasil","Uma enfermeira de Manaus viu a viagem dos sonhos de sete dias para a Europa se tornar um pesadelo, que vai completar dois meses na próxima quarta-feira (13). Alessandra Araújo, de 39 anos, ganhou o passeio em um sorteio como prêmio de melhor funcionária de 2019 na empresa de cuidados de saúde domiciliar em que trabalha há dois anos. Com o fechamento de fronteiras para conter a disseminação do coronavírus, ela teve o voo cancelado e ainda não conseguiu voltar ao Brasil.A viagem teve início em 13 de março, no dia seguinte da decretação do novo coronavírus como pandemia pela Organização Mundial da Saúde (OMS). O roteiro tinha início em Madri, na Espanha, e contemplava uma visita a cidade de Fátima, em Portugal, onde Alessandra iria cumprir uma promessa. Em poucos dias, entretanto, a evolução da doença fez com medidas de restrição social fossem impostas nos dois países e o primeiro-ministro português, António Costa, anunciou o fechamento progressivo das fronteiras ao lazer, proibindo turistas de entrar e sair. Com os voos cancelados, Alessandra acabou impedida de retornar ao Brasil.""Já não sei mais o que fazer para ir embora, só consigo chorar de desespero. Estou de mãos atadas, vivendo uma angústia, entrando em depressão. Todas as noites durmo cedo para ver se essa situação passa mais rápido, mas os dias vão correndo e eu ainda estou presa aqui"", conta a enfermeira, em entrevista à ÉPOCA.No dia 25 de março, Alessandra recebeu a notícia, através de uma prima, de que sua mãe, que tem 58 anos, está com coronavírus. Ela permanece internada desde então em uma unidade de saúde de Manaus e as atualizações sobre seu quadro de saúde são recebidas pela filha por mensagens de texto. Ela chegou a fazer ligações para o hospital, mas devido ao alto custo não pôde manter o contato.""Minha mãe está mal, diagnosticada com a Covid-19. Minha avó morreu com os sintomas da doença. Meu filho tem 18 anos e está sozinho em casa. E eu estou aqui, sem poder ir embora e sem família nem dinheiro"", diz a enfermeira.Alessandra relata que, com as últimas economias, pagou a estadia em um hostel. Quando o dinheiro acabou, foi convidada a se retirar do estabelecimento. Ela então foi para o Aeroporto Internacional de Lisboa, onde dormiu oito noites à espera por um voo de repatriação. Junto com outros brasileiros, recebeu doações de água e alimentos.Com a esperança de que fosse ajudar nos trâmites de retorno, a enfermeira enviou ao Consulado-Geral do Brasil em Lisboa uma declaração do trabalho de que seus serviços como profissional de saúde estavam sendo necessários em Manaus, mas não obteve retorno.Nesta quarta-feira (6), recebeu uma notificação do Ministério da Saúde questionando se ela tinha disponibilidade para atuar na linha de frente do combate ao coronavírus no Amazonas, um dos estados mais afetados pela doença.""Me coloquei à disposição para ajudar no combate a doença, mas infelizmente estou aqui presa, não tenho como voltar pra ajudar a minha cidade. Vejo tudo que está acontecendo em Manaus, minha mãe internada, a falta de profissionais, e eu aqui sem poder ajudar quem realmente precisa. O que estou vivendo aqui é realmente perturbador, um futuro incerto"", lamentou a enfermeira.Leia mais:",2020-05-09,https://epoca.globo.com/sociedade/premiada-por-desempenho-enfermeira-de-manaus-viaja-portugal-e-impedida-de-voltar-ao-brasil-24412938
Gugu investiu em clube americano de futebol para dar greencard a Rose,"Rose di Matteo, a mãe dos filhos de Gugu Liberato e que reivindica ser sua viúva, recebeu um greencard do governo americano graças a um investimento de cerca de US$ 500 mil que o apresentador fez no clube de futebol Orlando City Soccer.Ao se tornar uma investidora de peso, Rose conseguiu o greencard.O Orlando City Soccer é um dos clubes que mais cresce no futebol americano. Kaká já jogou pelo clube.A tempo: Gugu não tinha greencard. Entrava nos Estados Unidos como turista.ACESSE A HOME DA COLUNA E LEIA TODAS AS NOTAS, ENTREVISTAS E ANÁLISESLeia também:Acompanhe nas redes sociais: Facebook | Twitter | Instagram",2020-02-04,https://epoca.globo.com/guilherme-amado/gugu-investiu-em-clube-americano-de-futebol-para-dar-greencard-rose-24228887
Onze dos 19 maiores clubes de futebol no vermelho em 2018,"Onze dos 19 maiores clubes de futebol fecharam 2018 no vermelho.Os dados são de um estudo da Consultoria Legislativa da Câmara.Do maior para o menor déficit em 2018: Santos (R$ 77 milhões), Chapecoense (R$ 39 milhões), Cruzeiro (R$ 27 milhões), Atlético-MG, Corinthians, Botafogo, Sport, Internacional, Vitória, Coritiba e Fluminense.Somados, todos os 19 times tiveram um superávit de apenas R$ 38 milhões.(Por Eduardo Barretto)ACESSE A HOME DA COLUNA E LEIA TODAS AS NOTAS, ENTREVISTAS E ANÁLISESLeia também:Acompanhe nas redes sociais: Facebook | Twitter | Instagram",2020-01-21,https://epoca.globo.com/guilherme-amado/onze-dos-19-maiores-clubes-de-futebol-no-vermelho-em-2018-1-24200855
