Título,Notícia,Data,Link
"""A gente já conviveu com tudo aquilo"", desabafa Júnior sobre tragédia no Flamengo","O maestro do Flamengo, Leovegildo Lins Gama Júnior, eternizado no futebol com o último nome, é um dos maiores ídolos da história do rubro-negro carioca. Lateral esquerdo, fez parte de uma geração vitoriosa, quando, entre 1974 e 1984, dividiu os gramados com nomes como Zico, Adílio e Nunes. Ali foi tricampeão brasileiro, campeão das Américas e campeão do mundo. Chegou a jogar em outros clubes (e na seleção brasileira), mas foi no Flamengo que resolveu se aposentar.Afinal de contas, foi no clube da Gávea que Júnior, paraibano de nascimento e carioca de criação, se formou como jogador de futebol. Ele chegou ao mais querido do Rio em 1973, aos 19 anos, e mantém vínculos próximos com o clube até hoje, mais de quatro décadas depois. A ÉPOCA, o comentarista esportivo e ex-jogador falou da tragédia que se abateu sobre o Clube de Regatas do Flamengo nesta sexta-feira, vitimando 10 pessoas, inclusive jovens atletas que sonhavam em viver a mesma trajetória de Júnior.O que você sentiu após receber a notícia, sendo um jogador formado no Flamengo e com uma grande ligação com o clube? Primeiramente, há o sentimento como ser humano. De ver crianças com sonhos e ver esses sonhos serem destruídos ainda no início. Porque essa garotada, que chegou até ali, já deve ter passado por muitas situações até ter a possibilidade de fazer uma avaliação no Flamengo. E muitas vezes o objetivo maior não era nem somente eles se tornarem jogadores profissionais, mas criar um meio de sobrevivência para a família ao se tornarem profissionais.Como isso pode impactar o Flamengo?É difícil você encontrar palavras numa situação dessas. É uma fatalidade. Isso faz com que a gente possa refletir. Quem tem filho e quem tem neto começa a refletir sobre um pouco de tudo. Para o clube é um desastre muito grande. Acho que todos os atletas que passaram pela base, naturalmente, estão consternados. Porque a gente já viveu ali dentro, a gente já conviveu com tudo aquilo e sabe pelo que os garotos passaram e vão passar, todos aqueles que estão em busca desse sonho, não é?Você já esteve lá no local?O lugar em que eles estavam era uma estrutura legal, eu conhecia. Há dois anos, estive lá para conhecer essa estrutura de contêineres. Foi quando inauguraram outra área, a que o time profissional agora usa, mais moderna, que foi inaugurada em dezembro. Quer dizer, era um espaço legal, tinha ar-condicionado, tinha televisão, tinha uma boa cama, não era muito amplo, mas era um espaço bom,  porque foi usado pelo futebol profissional com o Vanderlei lá atrás, quando ele foi treinador. Não era uma coisa largada. É uma pena, porque essa garotada já ia ser transferida para outra estrutura, que o profissional deixou de usar quando migrou para o local mais moderno.",2019-02-08,https://epoca.globo.com/a-gente-ja-conviveu-com-tudo-aquilo-desabafa-junior-sobre-tragedia-no-flamengo-23438838
"'Vergonha racial', 'Agora chega': a repercussão internacional do racismo contra Taison","O episódio de racismo relacionado ao jogador brasileiro Taison, do Shakhtar Donetsk (Ucrânia), ganhou destaque nos principais jornais esportivos do mundo.Neste domingo (10), o meio-campista foi alvo de coros racistas da torcida do Dynamo de Kiev em partida do campeonato ucraniano.Taison reagiu chutando uma bola em direção aos torcedores adversários e montrando o dedo médio. Ele acabou expulso pelo gesto e deixou o campo às lágrimas, consolado pelos jogadores rivais.O Gazzetta dello Sport, da Itália, destacou: ""Na Ucrânia, Taison reage a racistas como Ballotelli: expulso"", em alusão ao caso do atacante italiano Mario Ballotelli, que também foi vítima de coro racista no jogo entre o Brescia, seu clube, e o Hellas Verona.Na ocasião, o jogador, cansado dos insultos, pegou a bola com mão e a chutou para o alto mesmo com a partida em andamento. Ele ameaçou abandonar o campo, mas foi demovido da ideia pelos companheiros.  A matéria do periódico italiano começa com a frase ""Agora chega"" e diz que Taison deve ter visto as imagens de Ballotelli no final de semana anterior. A publicação fala ainda em ""feridas profundas"", emendando que ""as lágrimas dos dois brasileiros do Shakhtar [o jogador Dentinho também sofreu insultos] revelam que esse coros deixam sua marca"". Por fim, lembra que o Dynamo repudiou a atitude de seus torcedores com uma mensagem dizendo: ""O futebol não é lugar de racismo"".O diário inglês The Sun classificou o episódio, em sua chamada, como ""vergonha racial"". O título da publicação diz: ""Craque do Shakhtar Donetsk Taison chocantamente expulso por reagir a racismo mostrando o dedo médio e chutando bola em direção a torcedores"". A matéria traz manifestações de torcedores no Twitter e lembra que o caso acontece uma semana depois de a partida entre Roma e Napoli ter sido paralisada por abusos raciais de torcedores contra o zagueiro senegalês Kalidou Koulibaly. Os jogadores precisaram pedir aos torcedores que parassem para que o jogo fosse retomado.Na Espanha, o jornal Marca publicou ""Expulso por chutar bola e insultar torcedores que lhe dedicavam cânticos racistas"", enquanto o As chamou o episódio de ""maior escândalo racista da época"" em chamada para vídeo. Já o alemão Der Spiegel adotou uma linha mais cautelosa ao escrever ""Jogador do Shakhtar é vítima aparente de ofensas racistas — e ganha cartão vermelho"". Em Portugal, o Record escreveu: ""Taison em lágrimas após expulsão por ter reagido a insultos racistas"". Em outra matéria, o Record ressaltou o pronunciamento do técnico da equipe, Luís Castro, em solidariedade a seus comandados. Ele não compareceu à entrevista coletiva após o jogo, preferindo se manifestar por um comunicado.Castro afirmou que seus jogadores ""mostraram caráter"". Disse ainda que ""qualquer manifestação de racismo é inaceitável. Foi e será uma vergonha para todos. Juntos devemos lutar contra isso, todos os dias, a cada minuto e a cada segundo"".Na Ucrânia, o tom foi distinto entre alguns periódicos. Enquanto o ZN destacou a resposta de Taison em seu Instagram, com o título ""Eu nunca vou calar a boca diante de um ato tão desumano e patético de racismo"", o Glavcom escreveu: ""Como Taison provocou os torcedores do Dynamo"", iniciando o texto pela interrupção da partida, em vez de ir direto ao episódio. O Pravda, em sua versão da Eslováquia, questionou a expulsão: ""Justiça?"".",2019-11-11,https://epoca.globo.com/esportes/vergonha-racial-agora-chega-repercussao-internacional-do-racismo-contra-taison-24074419
"‘Quero que o Estado me mate’, diz preso ao pedir para ser executado","Um detento de uma penitenciária no interior de São Paulo enviou uma carta à revista ÉPOCA para expressar o desejo de morrer. Após a  mensagem, enviada em abril deste ano, ele recebeu autorização para conceder entrevista e contar sua história. “Quero que o Estado me mate. Quero ser o primeiro preso executado do Brasil”, disse o homem de 50 anos, que está no sistema prisional desde 1990.Por três horas, falou de seus crimes, da vida desperdiçada na prisão, da família e da vontade de morrer. Pediu que seu nome e rosto fossem revelados, ilustrando o desejo de ser executado pelo Estado. ÉPOCA, entretanto, seguiu a ordem do juiz corregedor, que proibiu a revelação de sua identidade, para preservar não só a ele, mas também a sua família.“Sei que a Constituição Federal não permite a pena de morte, mas quero começar essa discussão. Sou soropositivo há 33 anos, tenho hepatite C. Minha pena é draconiana, impossível de cumprir. Não estou louco. Tomei essa decisão radical porque estou cansado”, disse o presidiário. A íntegra desta história está na reportagem de capa da revista Época desta semana: “MINHA PENA É IMPOSSÍVEL DE CUMPRIR” Condenado por homicídio pede para ser executado pelo Estado PERSONAGEM DA SEMANARAPINOECampeã mundial de futebol driblou Trump e quer salários iguais aos dos homensDIÁRIO DE UM DETENTO“MINHA PENA É IMPOSSÍVEL DE CUMPRIR”Condenado por homicídio pede para ser executado pelo Estado18 PERGUNTAS PARA...CELSO ROCHA DE BARROS“Há amplo espaço para a esquerda conversar com liberais”CRÔNICA DA SUPERAÇÃOCONTRA O IMOBILISMONovo coordenador da Lava Jato em Brasília quebrou barreiras até assumir o cargoA VIDA QUE ELE LEVOUCHICO DE OLIVEIRA (1933-2019)A morte do pai do ornitorrincoIN VINO VERITASMULTIPLICAI O VINHOAcordo com União Europeia dá ressaca em produtores brasileirosCONCORDAMOS EM DISCORDAROCIMAR ALAVERSE × JOÃO VIANNEYEspecialistas em educação debatem o Enem eletrônicoVASTO MUNDOMEDO NA CIDADE DO FERROO que fizeram com a Itabira de DrummondBIM BOM BIM BIM BOM BIMO SILÊNCIO DENTRO DO SILÊNCIOOs últimos meses de João Gilberto: “Isaura”, Miúcha, Gal, MajuVIVI PARA CONTARCOMO ME TORNEI UM INFLUENCIADOR DE LEITURAO advogado que virou facilitador de livrosRITOS DA VIDASEROTONINAUm trecho do novo livro de Michel HouellebecqColunistasGuilherme AmadoTrabalho infantil é outra coisa, presidenteMonica de BolleDilema moralHelio GurovitzÉ só tristeza, que não sai de mim, não sai de mim, não saiAllan SieberConrado Hübner MendesDeclaração Universal de Direitos da “Classe Média” Brasileira",2019-07-11,https://epoca.globo.com/brasil/quero-que-estado-me-mate-diz-preso-ao-pedir-para-ser-executado-23799232
"Como Bloomberg, empresário da comunicação, vai lidar com candidato Bloomberg","A confirmação do nome do ex-prefeito de Nova York Michael Bloomberg como um dos (muitos) pré-candidatos à Presidência dos EUA pelo Partido Democrata levantou questões sobre o impacto na disputa de um bilionário que tem cacife de sobra para financiar a própria campanha. Alguns analistas questionaram suas propostas de política externa, que flertam com posições defendidas pelos republicanos — ele foi filiado ao partido entre 2001 e 2007. Suas críticas a ideias como o imposto sobre grandes fortunas, presente nos programas de competidores como Elizabeth Warren e Bernie Sanders, o colocam sob luz favorável do ponto de vista de Wall Street e dos muito ricos. Há, porém, algo mais que se destaca nos primeiros passos da campanha de Bloomberg: ele é dono de uma das principais empresas de mídia dos EUA, que leva seu nome e é acompanhada por centenas de milhares de assinantes ao redor do mundo, incluindo veículos de imprensa e investidores. Daí surgiu a pergunta: como os jornalistas da agência Bloomberg vão cobrir a campanha presidencial do homem que paga seu salário?No ano passado, quando era categórico ao negar qualquer intenção de concorrer à Casa Branca, Bloomberg chegou a dizer que acabaria com a editoria de política se fosse candidato, dizendo que “não iria querer que as pessoas a quem paga salários escrevessem uma história negativa”. Seus próprios empregados se mostraram reticentes.No domingo, porém, o editor-chefe da Bloomberg News, John Micklethwait, tentou deixar as coisas um pouco mais claras. Em um memorando interno, distribuído por e-mail, reconheceu que “não seria fácil” fazer essa cobertura presidencial, um “terreno desconhecido”, como escreveu pouco depois o conselho editorial, em nota aos leitores. Micklethwait, desde 2015 no cargo, ressaltou que “jamais um candidato à Presidência foi dono de uma organização jornalística daquele porte”, e, seguindo para o lado prático, estabeleceu os limites para a cobertura sui generis.A primeira e talvez a mais controvertida é o veto a matérias investigativas sobre Michael Bloomberg, sua família e seus negócios, uma regra que já era seguida pela organização. A diferença, além do fato de ele estar na briga pela Casa Branca, é que, por uma questão de equanimidade, a restrição será aplicada também aos demais 17 pré-candidatos democratas (pautas sobre Trump e seus dois adversários no campo republicano estão liberadas, pelo menos até as convenções). As matérias devem lidar apenas com o noticiário do dia, pesquisas e posições sobre temas de campanha. “Não podemos tratar os adversários de Mike de maneira diferente”, afirmou Micklethwait no e-mail. Outro ponto diz respeito aos editoriais da empresa: o conselho editorial será suspenso e os textos sem assinatura, que refletiam as visões da organização e de seu dono, não serão distribuídos. Como ressalta uma análise da Columbia Journalism Review, dois dos responsáveis pelos artigos, David Shipley e Tim O’Brien, pediram licença para trabalhar na campanha do chefe. Na mensagem à equipe, Micklethwait afirma que a situação não é exatamente nova, lembrando do período de 12 anos de Bloomberg à frente da prefeitura de Nova York quando, segundo o editor, o veículo “conseguiu mostrar sua independência”. O relato, porém, não corresponde exatamente à realidade, segundo pessoas que trabalharam na empresa nessa época. Um deles, Henry Goldman, responsável por cobrir os atos do então prefeito, disse à American Journalism Review, em 2002, que “foi uma tarefa complicada”. Ao Financial Times, um editor que não quis se identificar lembrou das dificuldades para cobrir os atos de Bloomberg, mas ressaltou que a maior parte do material jornalístico da empresa no período era destinada a analistas e investidores do mercado financeiro. Em carta, o sindicato que representa os funcionários da agência se disse “extremamente alarmado com a decisão de silenciar os jornalistas”, defendendo a revisão das políticas anunciadas pelo editor-chefe. “Acreditamos que os jornalistas não devem apenas ter a permissão  — mas sim ser encorajados — a cobrir de forma abrangente cada um dos candidatos, como a profissão demanda em uma das mais importantes eleições da história moderna”, diz a carta.Fora das redações da Bloomberg, as críticas se avolumaram após a confirmação da candidatura. Jornalistas que participam da cobertura política nos EUA se mostraram temerosos com os impactos sobre os colegas, que poderiam ver sua credibilidade posta em xeque. Outros questionaram os efeitos sobre a campanha do democrata, que corre o risco de ser acusado de “controlar a própria narrativa”. Sobre esse aspecto, Micklethwait disse que os limites definidos no e-mail são apenas “recomendações”, não um “livro de regras”, e que há espaço para mudanças pontuais, decididas caso a caso.Leia também:",2019-11-26,https://epoca.globo.com/mundo/como-bloomberg-empresario-da-comunicacao-vai-lidar-com-candidato-bloomberg-24102121
A vida de luxo do doleiro dos doleiros,"Desde os anos 90, a cobertura de Dario Messer na Avenida Delfim Moreira, no Leblon, o metro quadrado mais caro do Brasil, foi palco de festas que misturavam os mundos do samba, do futebol e da política. A última delas, memorável para quem participou, ocorreu no ano passado, meses antes da Operação Câmbio, Desligo, que ordenou sua prisão. O doleiro abriu o terceiro andar do apartamento para a despedida de solteiro do filho Dan, de 27 anos. A celebração para 80 convidados foi marcada por champanhe Veuve Clicquot e charutos Gurkha Black Dragon, itens costumeiros em seus rega-bofes para a elite carioca.Estava tudo acertado para o herdeiro também ganhar uma megafesta de casamento, mas a Lava Jato apareceu no meio do caminho da família Messer. Agora, o imóvel de três andares está bloqueado pelo juiz Marcelo Bretas por fazer parte de uma investigação sobre lavagem de dinheiro. Foragido desde maio de 2018, Messer foi preso na tarde desta quarta-feira 31 no bairro dos Jardins, em São Paulo.O doleiro está no radar da Polícia Federal desde os anos 80, quando começou a aparecer como operador de personalidades ligadas ao samba e ao jogo do bicho, como o ex-presidente do Salgueiro Waldemir Garcia, o Miro. Em 2005, Messer também foi citado na CPI dos Bingos por supostamente auxiliar o PT na lavagem de recursos de campanha. Em 2018, a Operação Câmbio, Desligo mirou uma rede de operadores financeiros responsável por movimentar quantias bilionárias ilegalmente. Muitos doleiros foram presos, mas Messer, considerado o número um da categoria, escapou. Investigadores o apontam como o cérebro de um esquema de lavagem de mais de US$ 1,6 bilhão nos últimos anos.Leia mais:'Não lavávamos dinheiro, ele permanecia sujo', diz doleiro da Lava JatoA força-tarefa da Lava Jato vinha rastreando toda a lista de contatos do doleiro armazenada na nuvem de sua conta no iCloud. Por meio dela, os investigadores buscaram pistas de seu paradeiro. Eram cerca de 570 números de telefones, distribuídos em 19 páginas virtuais, que permitem um mapeamento das relações profissionais e de amizade do doleiro. É claro que não há nada de irregular em estar na agenda telefônica eletrônica de um foragido, mas a lista é um bom indicativo da pluralidade de sua teia de relacionamentos: há por ali o nome do ex-jogador Ronaldo Fenômeno, de quem é amigo desde que ele despontava no Cruzeiro aos 15 anos e com quem viajou para Rússia, Israel e África do Sul. Há também o ex-presidente paraguaio Horacio Cartes, parceiro de negócios de décadas, e seus familiares. A lista contempla ainda do Pastor Everaldo, ex-candidato ao Planalto em 2014 e hoje presidente do PSC, a Jayder Soares, chefão da Grande Rio, escola de samba tradicional da Baixada Fluminense.Messer por diversas vezes reconheceu seu potencial de homem-bomba. Há três anos, em conversas com interlocutores, o doleiro deixou seu recado: dizia estar cansado de ser “boi de piranha” de políticos e que estava com vontade de “colocar a boca no trombone”.A lista de bens de Messer inclui quatro imóveis, dois deles residenciais e dois comerciais nos bairros de Ipanema e Leblon. Sua coleção de arte incluía pinturas da autoria de Di Cavalcanti. No material avistado pela Polícia Federal durante a operação de 2018, há até um desenho com uma dedicatória de Di Cavalcanti ao polonês Mordko Messer, já falecido, pai de Dario e apontado como o primeiro doleiro a atuar no Brasil.Leia mais: Doleiro Dario Messer tem R$ 395 milhões em bens no ParaguaiA entrada de Dario nos negócios com dólares, euros etc. remonta aos anos 90 e se deu graças a seu pai. No mesmo período, Horacio Cartes era foragido da Justiça por evasão de divisas. Ele foi acolhido no Rio por Mordko Messer. Nascia assim uma parceria de longo prazo em operações de câmbio. Cartes foi fundamental na conexão entre Ponta Porã, cidade de Mato Grosso do Sul, e Pedro Juan Caballero, no Paraguai, em que corria o fluxo de recursos que poderiam ficar no Brasil ou seguir para os Estados Unidos. Na época, uma casa de câmbio e um banco chamado Amambay S.A. uniam as atuações das famílias. Além de atuar no mercado de câmbio, Cartes tornou-se um milionário da área do tabaco e comandou até time de futebol. Entrou na política em 2008, pelo partido Colorado, e cinco anos depois alcançou a Presidência da República.Enquanto o amigo assumia o comando do país vizinho — Cartes já declarou certa vez que Messer é seu “irmão de alma” —, os negócios do doleiro prosperavam. Um levantamento de bens feito pelo governo paraguaio mostra que Messer construiu um patrimônio de quase US$ 100 milhões. As autoridades locais já confiscaram sete fazendas espalhadas pelo país, uma granja, dois edifícios de luxo para escritórios e 30 lotes de terrenos no luxuoso Paraná Country Club, próximo a Assunção. Em um deles, Messer construiu uma estrada própria para ter acesso ao Rio Paraná. Em sua fazenda preferida, chamada Diana, ele cuidava de cerca de 8 mil cabeças de gado e quase 9 mil hectares de plantação.Doleiros e amigos do passado afirmaram que Dario Messer não era deslumbrado com sua fortuna (e, justamente por isso, atraía a tantos). “Não existia arrogância, não existia mostrar o que ele tinha financeiramente. Ele era simples e educado, não se sentia superior a ninguém”, disse um frequentador da cobertura da Avenida Delfim Moreira.",2019-07-31,https://epoca.globo.com/brasil/a-vida-de-luxo-do-doleiro-dos-doleiros-23845751
Fla-Peru em festa: flamenguistas em Lima comemoram decisão 'em casa',"No fim da tarde de terça (5), o empresário José Luiz Viana, 62, recebeu a sequência de mensagens eufóricas de seus amigos flamenguistas pelo Whatsapp. A Conmebol havia decidido transferir a partida final da Copa Libertadores, entre Flamengo e River Plate, para Lima, no Peru - no próximo dia 23 de novembro.“Ver o Flamengo jogar a final da Libertadores em nossa casa é um evento mais importante do que Copa do Mundo”, afirmou Viana, que mora na capital peruana assim como seus amigos do grupo no Whatsapp.Viana é um dos integrantes da Fla-Peru, torcida do clube rubro-negro na cidade de Lima, mencionada inclusive no site oficial do Flamengo em uma lista de ""consulados"" do clube no exterior.O alpinista industrial João Marcos Sampaio, de 27 anos, mora há três anos em Lima e criou, em 2018, a página Nação Rubro Negra Fla-Peru, no Facebook. Ele já começou a conversar com os flamenguistas que pretendem viajar para o Chile. ""Já estamos em contato com alguns brasileiros que querem vir para cá. A ideia é aumentar nosso grupo e fazer uma grande recepção para o time do Flamengo já no aeroporto de Lima"", planeja Sampaio, que está na expectativa para garantir sua presença no estádio. ""Estamos apreensivos à espera do início das vendas dos ingressos. Todos queremos ir ao Monumental."" Na partida contra o Grêmio, pela semifinal da Libertadores, ele se reuniu com outros torcedores em um bar alemão na capital peruana. ""Ninguém esperava o 5x0. Os outros frequentadores ficaram espantados com a nossa comemoração.""Para o dentista Marcelo Santana, de 44 anos, a mobilização em torno dos jogos do Flamengo na atual temporada fortaleceu os laços entre os integrantes da Fla-Peru. ""O jogo contra o Grêmio, em especial, fez com que a gente se unisse aqui no Peru. Não somos muitos por aquil. É difícil reunir todos. Mas a Nação Rubro-Negra Fla-Peru existe.""Fundador da torcida Fla-Peru, Jayme da Cunha, 40 anos, já havia comprado a passagem para Santiago, no Chile, local previsto para a final mas que acabou descartado pela Conmebol em razão da instabilidade política no país.""Está todo mundo feliz de perder o dinheiro da passagem, caso não dê para recuperar. Isso ficou em segundo plano”, diz Cunha, que costuma assistir aos jogos com os integrantes da Fla-Peru em bares de Lima.“Já estamos organizando até festa para receber flamenguistas que vêm do Brasil”, disse o representante da Fla-Peru.  Segue o LÍDER! #flaperu #flamengo #liderançaUma publicação compartilhada por  乃尺Uれ口 Ｊ丹匚Uれ刀Á (@brunojacundamma) em 26 de Ago, 2019 às 8:29 PDTLutador de MMA, o paraense Bruno Jacundá é outro morador de Lima emocionado com a notícia. Em caso de título, promete fazer tatuagens do estádio Monumental e da data da final.“Todo mundo ficou louco com essa notícia por aqui”, contou.Ele viu o Flamengo pela primeira vez dentro de um estádio em 2014, quando foi morar no Rio de Janeiro.“Desde pequeno, sempre fui doente pelo Flamengo. Era um sonho para mim vê-lo jogar de perto. Agora, vou viver esse sonho de novo”, disse Jacundá, que ainda não comprou seu ingresso.O jogo será realizado no Estádio Monumental de Lima, com capacidade para aproximadamente 80 mil torcedores. São cerca de 30 mil lugares a mais do que a previsão para a partida no estádio Nacional, na capital chilena.Nesta final, os flamenguistas de Lima acreditam que os torcedores peruanos estarão ao lado do time brasileiro. A simpatia pelo rubro-negro estaria relacionada ao atacante Paolo Guerrero e ao lateral-esquerdo Miguel Trauco, destaques do futebol peruano que já jogaram pelo Flamengo.",2019-11-07,https://epoca.globo.com/esportes/fla-peru-em-festa-flamenguistas-em-lima-comemoram-decisao-em-casa-24065873
